python_test/runtime/lenet_example_log.txt
{"i": [["[\"Layer(\\nops=\\nOp0([1, 1, 32, 32])\\nread_graph=()\\nOp1(\\nSpatial\\naxis=(v0:[1], v1:[1], v2:[32], v3:[32])\\nreduce_axis=()\\ncombiner=()\\nsource=(\\nT0[v0, v1, v2, v3])\\n)\\nread_graph=(Op0)\\nOp2([6, 1, 5, 5])\\nread_graph=()\\nOp3(\\nReduce\\naxis=(v0:[1], v1:[6], v2:[28], v3:[28])\\nreduce_axis=(v4:[1], v5:[5], v6:[5])\\ncombiner=(comm_reducer(result=[(v7 + v8)], lhs=[v7], rhs=[v8], identity_element=[0f]))\\nsource=(\\n(T0[v0, v4, (v2 + v5), (v3 + v6)]*T1[v1, v4, v5, v6]))\\n)\\nread_graph=(Op1, Op2)\\n)\\n\"]", "cuda -keys=cuda,gpu -max_num_threads=1024 -thread_warp_size=32", [-1, 16, 64, 49152, 2147483647, 1024, 8, 32], "", 0, []], [[], [["CHW", 3, "local"], ["SP", 3, 0, 1, [1, 1, 1, 1], 1], ["SP", 3, 5, 6, [1, 3, 1, 1], 1], ["SP", 3, 10, 28, [4, 7, 1, 1], 1], ["SP", 3, 15, 28, [1, 2, 1, 2], 1], ["SP", 3, 20, 1, [1, 1], 1], ["SP", 3, 23, 5, [1, 5], 1], ["SP", 3, 26, 5, [5, 1], 1], ["RE", 3, [0, 5, 10, 15, 1, 6, 11, 16, 2, 7, 12, 17, 20, 23, 26, 21, 24, 27, 3, 8, 13, 18, 22, 25, 28, 4, 9, 14, 19]], ["FSP", 4, 0, 1, 3], ["FSP", 4, 4, 2, 3], ["FSP", 4, 8, 3, 3], ["FSP", 4, 12, 4, 3], ["RE", 4, [0, 4, 8, 12, 1, 5, 9, 13, 2, 6, 10, 14, 3, 7, 11, 15]], ["CA", 3, 4, 11], ["CHR", 2, "shared", [3]], ["CA", 3, 4, 14], ["CHR", 1, "shared", [4]], ["CA", 2, 5, 14], ["CI", 1], ["FU", 6, [0, 1, 2, 3]], ["AN", 6, 0, 5], ["FU", 6, [1, 2, 3, 4]], ["AN", 6, 1, 4], ["FU", 6, [2, 3, 4, 5]], ["AN", 6, 2, 6], ["FU", 4, [0, 1, 2, 3]], ["SP", 4, 0, 25, [1], 1], ["AN", 4, 1, 2], ["FFSP", 4, 0, [4, 3, 2, 1], 1, 1], ["AN", 4, 1, 6], ["FU", 2, [0, 1, 2, 3]], ["SP", 2, 0, 36, [12], 1], ["AN", 2, 1, 2], ["FFSP", 2, 0, [4, 3, 2, 1], 1, 1], ["AN", 2, 1, 6], ["PR", 5, 0, "auto_unroll_max_step$1024"]]]], "r": [[3.49943e-06], 0, 2.06393, 1634814412], "v": "v0.6"}
{"i": [["[\"Layer(\\nops=\\nOp0([1, 1, 32, 32])\\nread_graph=()\\nOp1(\\nSpatial\\naxis=(v0:[1], v1:[1], v2:[32], v3:[32])\\nreduce_axis=()\\ncombiner=()\\nsource=(\\nT0[v0, v1, v2, v3])\\n)\\nread_graph=(Op0)\\nOp2([6, 1, 5, 5])\\nread_graph=()\\nOp3(\\nReduce\\naxis=(v0:[1], v1:[6], v2:[28], v3:[28])\\nreduce_axis=(v4:[1], v5:[5], v6:[5])\\ncombiner=(comm_reducer(result=[(v7 + v8)], lhs=[v7], rhs=[v8], identity_element=[0f]))\\nsource=(\\n(T0[v0, v4, (v2 + v5), (v3 + v6)]*T1[v1, v4, v5, v6]))\\n)\\nread_graph=(Op1, Op2)\\n)\\n\"]", "cuda -keys=cuda,gpu -max_num_threads=1024 -thread_warp_size=32", [-1, 16, 64, 49152, 2147483647, 1024, 8, 32], "", 0, []], [[], [["CHW", 3, "local"], ["SP", 3, 0, 1, [1, 1, 1, 1], 1], ["SP", 3, 5, 6, [1, 6, 1, 1], 1], ["SP", 3, 10, 28, [1, 14, 2, 1], 1], ["SP", 3, 15, 28, [4, 1, 1, 7], 1], ["SP", 3, 20, 1, [1, 1], 1], ["SP", 3, 23, 5, [1, 5], 1], ["SP", 3, 26, 5, [1, 5], 1], ["RE", 3, [0, 5, 10, 15, 1, 6, 11, 16, 2, 7, 12, 17, 20, 23, 26, 21, 24, 27, 3, 8, 13, 18, 22, 25, 28, 4, 9, 14, 19]], ["FSP", 4, 0, 1, 3], ["FSP", 4, 4, 2, 3], ["FSP", 4, 8, 3, 3], ["FSP", 4, 12, 4, 3], ["RE", 4, [0, 4, 8, 12, 1, 5, 9, 13, 2, 6, 10, 14, 3, 7, 11, 15]], ["CA", 3, 4, 11], ["CHR", 2, "shared", [3]], ["CA", 3, 4, 14], ["CHR", 1, "shared", [4]], ["CA", 2, 5, 14], ["CI", 1], ["FU", 6, [0, 1, 2, 3]], ["AN", 6, 0, 5], ["FU", 6, [1, 2, 3, 4]], ["AN", 6, 1, 4], ["FU", 6, [2, 3, 4, 5]], ["AN", 6, 2, 6], ["FU", 4, [0, 1, 2, 3]], ["SP", 4, 0, 25, [1], 1], ["AN", 4, 1, 2], ["FFSP", 4, 0, [4, 3, 2, 1], 1, 1], ["AN", 4, 1, 6], ["FU", 2, [0, 1, 2, 3]], ["SP", 2, 0, 66, [1], 1], ["AN", 2, 1, 2], ["FFSP", 2, 0, [4, 3, 2, 1], 1, 1], ["AN", 2, 1, 6], ["PR", 5, 0, "auto_unroll_max_step$1024"]]]], "r": [[1.46322e-05], 0, 2.48016, 1634814413], "v": "v0.6"}
{"i": [["[\"Layer(\\nops=\\nOp0([1, 1, 32, 32])\\nread_graph=()\\nOp1(\\nSpatial\\naxis=(v0:[1], v1:[1], v2:[32], v3:[32])\\nreduce_axis=()\\ncombiner=()\\nsource=(\\nT0[v0, v1, v2, v3])\\n)\\nread_graph=(Op0)\\nOp2([6, 1, 5, 5])\\nread_graph=()\\nOp3(\\nReduce\\naxis=(v0:[1], v1:[6], v2:[28], v3:[28])\\nreduce_axis=(v4:[1], v5:[5], v6:[5])\\ncombiner=(comm_reducer(result=[(v7 + v8)], lhs=[v7], rhs=[v8], identity_element=[0f]))\\nsource=(\\n(T0[v0, v4, (v2 + v5), (v3 + v6)]*T1[v1, v4, v5, v6]))\\n)\\nread_graph=(Op1, Op2)\\n)\\n\"]", "cuda -keys=cuda,gpu -max_num_threads=1024 -thread_warp_size=32", [-1, 16, 64, 49152, 2147483647, 1024, 8, 32], "", 0, []], [[], [["CHW", 3, "local"], ["SP", 3, 0, 1, [1, 1, 1, 1], 1], ["SP", 3, 5, 6, [1, 1, 3, 2], 1], ["SP", 3, 10, 28, [1, 7, 1, 1], 1], ["SP", 3, 15, 28, [1, 28, 1, 1], 1], ["SP", 3, 20, 1, [1, 1], 1], ["SP", 3, 23, 5, [1, 5], 1], ["SP", 3, 26, 5, [1, 1], 1], ["RE", 3, [0, 5, 10, 15, 1, 6, 11, 16, 2, 7, 12, 17, 20, 23, 26, 21, 24, 27, 3, 8, 13, 18, 22, 25, 28, 4, 9, 14, 19]], ["FSP", 4, 0, 1, 3], ["FSP", 4, 4, 2, 3], ["FSP", 4, 8, 3, 3], ["FSP", 4, 12, 4, 3], ["RE", 4, [0, 4, 8, 12, 1, 5, 9, 13, 2, 6, 10, 14, 3, 7, 11, 15]], ["CA", 3, 4, 11], ["CHR", 2, "shared", [3]], ["CA", 3, 4, 14], ["CHR", 1, "shared", [4]], ["CA", 2, 5, 14], ["CI", 1], ["FU", 6, [0, 1, 2, 3]], ["AN", 6, 0, 5], ["FU", 6, [1, 2, 3, 4]], ["AN", 6, 1, 4], ["FU", 6, [2, 3, 4, 5]], ["AN", 6, 2, 6], ["FU", 4, [0, 1, 2, 3]], ["SP", 4, 0, 15, [1], 1], ["AN", 4, 1, 2], ["FFSP", 4, 0, [4, 3, 2, 1], 1, 1], ["AN", 4, 1, 6], ["FU", 2, [0, 1, 2, 3]], ["SP", 2, 0, 5, [5], 1], ["AN", 2, 1, 2], ["FFSP", 2, 0, [4, 3, 2, 1], 1, 1], ["AN", 2, 1, 6], ["PR", 5, 0, "auto_unroll_max_step$1024"]]]], "r": [[4.29152e-06], 0, 1.62379, 1634814413], "v": "v0.6"}
{"i": [["[\"Layer(\\nops=\\nOp0([1, 1, 32, 32])\\nread_graph=()\\nOp1(\\nSpatial\\naxis=(v0:[1], v1:[1], v2:[32], v3:[32])\\nreduce_axis=()\\ncombiner=()\\nsource=(\\nT0[v0, v1, v2, v3])\\n)\\nread_graph=(Op0)\\nOp2([6, 1, 5, 5])\\nread_graph=()\\nOp3(\\nReduce\\naxis=(v0:[1], v1:[6], v2:[28], v3:[28])\\nreduce_axis=(v4:[1], v5:[5], v6:[5])\\ncombiner=(comm_reducer(result=[(v7 + v8)], lhs=[v7], rhs=[v8], identity_element=[0f]))\\nsource=(\\n(T0[v0, v4, (v2 + v5), (v3 + v6)]*T1[v1, v4, v5, v6]))\\n)\\nread_graph=(Op1, Op2)\\n)\\n\"]", "cuda -keys=cuda,gpu -max_num_threads=1024 -thread_warp_size=32", [-1, 16, 64, 49152, 2147483647, 1024, 8, 32], "", 0, []], [[], [["CHW", 3, "local"], ["SP", 3, 0, 1, [1, 1, 1, 1], 1], ["SP", 3, 5, 6, [2, 3, 1, 1], 1], ["SP", 3, 10, 28, [2, 7, 2, 1], 1], ["SP", 3, 15, 28, [1, 14, 2, 1], 1], ["SP", 3, 20, 1, [1, 1], 1], ["SP", 3, 23, 5, [5, 1], 1], ["SP", 3, 26, 5, [5, 1], 1], ["RE", 3, [0, 5, 10, 15, 1, 6, 11, 16, 2, 7, 12, 17, 20, 23, 26, 21, 24, 27, 3, 8, 13, 18, 22, 25, 28, 4, 9, 14, 19]], ["FSP", 4, 0, 1, 3], ["FSP", 4, 4, 2, 3], ["FSP", 4, 8, 3, 3], ["FSP", 4, 12, 4, 3], ["RE", 4, [0, 4, 8, 12, 1, 5, 9, 13, 2, 6, 10, 14, 3, 7, 11, 15]], ["CA", 3, 4, 11], ["CHR", 2, "shared", [3]], ["CA", 3, 4, 14], ["CHR", 1, "shared", [4]], ["CA", 2, 5, 14], ["CI", 1], ["FU", 6, [0, 1, 2, 3]], ["AN", 6, 0, 5], ["FU", 6, [1, 2, 3, 4]], ["AN", 6, 1, 4], ["FU", 6, [2, 3, 4, 5]], ["AN", 6, 2, 6], ["FU", 4, [0, 1, 2, 3]], ["SP", 4, 0, 5, [1], 1], ["AN", 4, 1, 2], ["FFSP", 4, 0, [4, 3, 2, 1], 1, 1], ["AN", 4, 1, 6], ["FU", 2, [0, 1, 2, 3]], ["SP", 2, 0, 12, [1], 1], ["AN", 2, 1, 2], ["FFSP", 2, 0, [4, 3, 2, 1], 1, 1], ["AN", 2, 1, 6], ["PR", 5, 0, "auto_unroll_max_step$64"]]]], "r": [[5.31049e-06], 0, 1.28286, 1634814414], "v": "v0.6"}
{"i": [["[\"Layer(\\nops=\\nOp0([1, 1, 32, 32])\\nread_graph=()\\nOp1(\\nSpatial\\naxis=(v0:[1], v1:[1], v2:[32], v3:[32])\\nreduce_axis=()\\ncombiner=()\\nsource=(\\nT0[v0, v1, v2, v3])\\n)\\nread_graph=(Op0)\\nOp2([6, 1, 5, 5])\\nread_graph=()\\nOp3(\\nReduce\\naxis=(v0:[1], v1:[6], v2:[28], v3:[28])\\nreduce_axis=(v4:[1], v5:[5], v6:[5])\\ncombiner=(comm_reducer(result=[(v7 + v8)], lhs=[v7], rhs=[v8], identity_element=[0f]))\\nsource=(\\n(T0[v0, v4, (v2 + v5), (v3 + v6)]*T1[v1, v4, v5, v6]))\\n)\\nread_graph=(Op1, Op2)\\n)\\n\"]", "cuda -keys=cuda,gpu -max_num_threads=1024 -thread_warp_size=32", [-1, 16, 64, 49152, 2147483647, 1024, 8, 32], "", 0, []], [[], [["CHW", 3, "local"], ["SP", 3, 0, 1, [1, 1, 1, 1], 1], ["SP", 3, 5, 6, [1, 2, 1, 3], 1], ["SP", 3, 10, 28, [2, 2, 1, 1], 1], ["SP", 3, 15, 28, [1, 28, 1, 1], 1], ["SP", 3, 20, 1, [1, 1], 1], ["SP", 3, 23, 5, [5, 1], 1], ["SP", 3, 26, 5, [1, 1], 1], ["RE", 3, [0, 5, 10, 15, 1, 6, 11, 16, 2, 7, 12, 17, 20, 23, 26, 21, 24, 27, 3, 8, 13, 18, 22, 25, 28, 4, 9, 14, 19]], ["FSP", 4, 0, 1, 3], ["FSP", 4, 4, 2, 3], ["FSP", 4, 8, 3, 3], ["FSP", 4, 12, 4, 3], ["RE", 4, [0, 4, 8, 12, 1, 5, 9, 13, 2, 6, 10, 14, 3, 7, 11, 15]], ["CA", 3, 4, 11], ["CHR", 2, "shared", [3]], ["CA", 3, 4, 14], ["CHR", 1, "shared", [4]], ["CA", 2, 5, 14], ["CI", 1], ["FU", 6, [0, 1, 2, 3]], ["AN", 6, 0, 5], ["FU", 6, [1, 2, 3, 4]], ["AN", 6, 1, 4], ["FU", 6, [2, 3, 4, 5]], ["AN", 6, 2, 6], ["FU", 4, [0, 1, 2, 3]], ["SP", 4, 0, 15, [1], 1], ["AN", 4, 1, 2], ["FFSP", 4, 0, [4, 3, 2, 1], 1, 1], ["AN", 4, 1, 6], ["FU", 2, [0, 1, 2, 3]], ["SP", 2, 0, 5, [5], 1], ["AN", 2, 1, 2], ["FFSP", 2, 0, [4, 3, 2, 1], 1, 1], ["AN", 2, 1, 6], ["PR", 5, 0, "auto_unroll_max_step$64"]]]], "r": [[3.28926e-06], 0, 1.3308, 1634814414], "v": "v0.6"}
{"i": [["[\"Layer(\\nops=\\nOp0([1, 1, 32, 32])\\nread_graph=()\\nOp1(\\nSpatial\\naxis=(v0:[1], v1:[1], v2:[32], v3:[32])\\nreduce_axis=()\\ncombiner=()\\nsource=(\\nT0[v0, v1, v2, v3])\\n)\\nread_graph=(Op0)\\nOp2([6, 1, 5, 5])\\nread_graph=()\\nOp3(\\nReduce\\naxis=(v0:[1], v1:[6], v2:[28], v3:[28])\\nreduce_axis=(v4:[1], v5:[5], v6:[5])\\ncombiner=(comm_reducer(result=[(v7 + v8)], lhs=[v7], rhs=[v8], identity_element=[0f]))\\nsource=(\\n(T0[v0, v4, (v2 + v5), (v3 + v6)]*T1[v1, v4, v5, v6]))\\n)\\nread_graph=(Op1, Op2)\\n)\\n\"]", "cuda -keys=cuda,gpu -max_num_threads=1024 -thread_warp_size=32", [-1, 16, 64, 49152, 2147483647, 1024, 8, 32], "", 0, []], [[], [["CHW", 3, "local"], ["SP", 3, 0, 1, [1, 1, 1, 1], 1], ["SP", 3, 5, 6, [3, 1, 2, 1], 1], ["SP", 3, 10, 28, [2, 7, 2, 1], 1], ["SP", 3, 15, 28, [1, 4, 1, 7], 1], ["SP", 3, 20, 1, [1, 1], 1], ["SP", 3, 23, 5, [5, 1], 1], ["SP", 3, 26, 5, [1, 5], 1], ["RE", 3, [0, 5, 10, 15, 1, 6, 11, 16, 2, 7, 12, 17, 20, 23, 26, 21, 24, 27, 3, 8, 13, 18, 22, 25, 28, 4, 9, 14, 19]], ["FSP", 4, 0, 1, 3], ["FSP", 4, 4, 2, 3], ["FSP", 4, 8, 3, 3], ["FSP", 4, 12, 4, 3], ["RE", 4, [0, 4, 8, 12, 1, 5, 9, 13, 2, 6, 10, 14, 3, 7, 11, 15]], ["CA", 3, 4, 11], ["CHR", 2, "shared", [3]], ["CA", 3, 4, 14], ["CHR", 1, "shared", [4]], ["CA", 2, 5, 14], ["CI", 1], ["FU", 6, [0, 1, 2, 3]], ["AN", 6, 0, 5], ["FU", 6, [1, 2, 3, 4]], ["AN", 6, 1, 4], ["FU", 6, [2, 3, 4, 5]], ["AN", 6, 2, 6], ["FU", 4, [0, 1, 2, 3]], ["SP", 4, 0, 50, [1], 1], ["AN", 4, 1, 2], ["FFSP", 4, 0, [4, 3, 2, 1], 1, 1], ["AN", 4, 1, 6], ["FU", 2, [0, 1, 2, 3]], ["SP", 2, 0, 66, [1], 1], ["AN", 2, 1, 2], ["FFSP", 2, 0, [4, 3, 2, 1], 1, 1], ["AN", 2, 1, 6], ["PR", 5, 0, "auto_unroll_max_step$1024"]]]], "r": [[1.84228e-05], 0, 2.70252, 1634814415], "v": "v0.6"}
{"i": [["[\"Layer(\\nops=\\nOp0([1, 1, 32, 32])\\nread_graph=()\\nOp1(\\nSpatial\\naxis=(v0:[1], v1:[1], v2:[32], v3:[32])\\nreduce_axis=()\\ncombiner=()\\nsource=(\\nT0[v0, v1, v2, v3])\\n)\\nread_graph=(Op0)\\nOp2([6, 1, 5, 5])\\nread_graph=()\\nOp3(\\nReduce\\naxis=(v0:[1], v1:[6], v2:[28], v3:[28])\\nreduce_axis=(v4:[1], v5:[5], v6:[5])\\ncombiner=(comm_reducer(result=[(v7 + v8)], lhs=[v7], rhs=[v8], identity_element=[0f]))\\nsource=(\\n(T0[v0, v4, (v2 + v5), (v3 + v6)]*T1[v1, v4, v5, v6]))\\n)\\nread_graph=(Op1, Op2)\\n)\\n\"]", "cuda -keys=cuda,gpu -max_num_threads=1024 -thread_warp_size=32", [-1, 16, 64, 49152, 2147483647, 1024, 8, 32], "", 0, []], [[], [["CHW", 3, "local"], ["SP", 3, 0, 1, [1, 1, 1, 1], 1], ["SP", 3, 5, 6, [1, 1, 6, 1], 1], ["SP", 3, 10, 28, [1, 28, 1, 1], 1], ["SP", 3, 15, 28, [2, 7, 1, 1], 1], ["SP", 3, 20, 1, [1, 1], 1], ["SP", 3, 23, 5, [1, 1], 1], ["SP", 3, 26, 5, [5, 1], 1], ["RE", 3, [0, 5, 10, 15, 1, 6, 11, 16, 2, 7, 12, 17, 20, 23, 26, 21, 24, 27, 3, 8, 13, 18, 22, 25, 28, 4, 9, 14, 19]], ["FSP", 4, 0, 1, 3], ["FSP", 4, 4, 2, 3], ["FSP", 4, 8, 3, 3], ["FSP", 4, 12, 4, 3], ["RE", 4, [0, 4, 8, 12, 1, 5, 9, 13, 2, 6, 10, 14, 3, 7, 11, 15]], ["CA", 3, 4, 11], ["CHR", 2, "shared", [3]], ["CA", 3, 4, 14], ["CHR", 1, "shared", [4]], ["CA", 2, 5, 14], ["CI", 1], ["FU", 6, [0, 1, 2, 3]], ["AN", 6, 0, 5], ["FU", 6, [1, 2, 3, 4]], ["AN", 6, 1, 4], ["FU", 6, [2, 3, 4, 5]], ["AN", 6, 2, 6], ["FU", 4, [0, 1, 2, 3]], ["SP", 4, 0, 30, [1], 1], ["AN", 4, 1, 2], ["FFSP", 4, 0, [4, 3, 2, 1], 1, 1], ["AN", 4, 1, 6], ["FU", 2, [0, 1, 2, 3]], ["SP", 2, 0, 5, [1], 1], ["AN", 2, 1, 2], ["FFSP", 2, 0, [4, 3, 2, 1], 1, 1], ["AN", 2, 1, 6], ["PR", 5, 0, "auto_unroll_max_step$16"]]]], "r": [[4.37876e-06], 0, 1.26967, 1634814415], "v": "v0.6"}
{"i": [["[\"Layer(\\nops=\\nOp0([1, 1, 32, 32])\\nread_graph=()\\nOp1(\\nSpatial\\naxis=(v0:[1], v1:[1], v2:[32], v3:[32])\\nreduce_axis=()\\ncombiner=()\\nsource=(\\nT0[v0, v1, v2, v3])\\n)\\nread_graph=(Op0)\\nOp2([6, 1, 5, 5])\\nread_graph=()\\nOp3(\\nReduce\\naxis=(v0:[1], v1:[6], v2:[28], v3:[28])\\nreduce_axis=(v4:[1], v5:[5], v6:[5])\\ncombiner=(comm_reducer(result=[(v7 + v8)], lhs=[v7], rhs=[v8], identity_element=[0f]))\\nsource=(\\n(T0[v0, v4, (v2 + v5), (v3 + v6)]*T1[v1, v4, v5, v6]))\\n)\\nread_graph=(Op1, Op2)\\n)\\n\"]", "cuda -keys=cuda,gpu -max_num_threads=1024 -thread_warp_size=32", [-1, 16, 64, 49152, 2147483647, 1024, 8, 32], "", 0, []], [[], [["CHW", 3, "local"], ["SP", 3, 0, 1, [1, 1, 1, 1], 1], ["SP", 3, 5, 6, [1, 2, 1, 1], 1], ["SP", 3, 10, 28, [1, 4, 1, 7], 1], ["SP", 3, 15, 28, [1, 14, 1, 2], 1], ["SP", 3, 20, 1, [1, 1], 1], ["SP", 3, 23, 5, [1, 1], 1], ["SP", 3, 26, 5, [5, 1], 1], ["RE", 3, [0, 5, 10, 15, 1, 6, 11, 16, 2, 7, 12, 17, 20, 23, 26, 21, 24, 27, 3, 8, 13, 18, 22, 25, 28, 4, 9, 14, 19]], ["FSP", 4, 0, 1, 3], ["FSP", 4, 4, 2, 3], ["FSP", 4, 8, 3, 3], ["FSP", 4, 12, 4, 3], ["RE", 4, [0, 4, 8, 12, 1, 5, 9, 13, 2, 6, 10, 14, 3, 7, 11, 15]], ["CA", 3, 4, 11], ["CHR", 2, "shared", [3]], ["CA", 3, 4, 14], ["CHR", 1, "shared", [4]], ["CA", 2, 5, 14], ["CI", 1], ["FU", 6, [0, 1, 2, 3]], ["AN", 6, 0, 5], ["FU", 6, [1, 2, 3, 4]], ["AN", 6, 1, 4], ["FU", 6, [2, 3, 4, 5]], ["AN", 6, 2, 6], ["FU", 4, [0, 1, 2, 3]], ["SP", 4, 0, 1, [1], 1], ["AN", 4, 1, 2], ["FFSP", 4, 0, [4, 3, 2, 1], 1, 1], ["AN", 4, 1, 6], ["FU", 2, [0, 1, 2, 3]], ["SP", 2, 0, 14, [1], 1], ["AN", 2, 1, 2], ["FFSP", 2, 0, [4, 3, 2, 1], 1, 1], ["AN", 2, 1, 6], ["PR", 5, 0, "auto_unroll_max_step$1024"]]]], "r": [[5.06421e-06], 0, 1.85829, 1634814416], "v": "v0.6"}
{"i": [["[\"Layer(\\nops=\\nOp0([1, 6, 28, 28])\\nread_graph=()\\nOp1(\\nSpatial\\naxis=(v0:[1], v1:[6], v2:[28], v3:[28])\\nreduce_axis=()\\ncombiner=()\\nsource=(\\ntir.if_then_else((T0[v0, v1, v2, v3] > 0f), T0[v0, v1, v2, v3], 0f))\\n)\\nread_graph=(Op0)\\n)\\n\"]", "cuda -keys=cuda,gpu -max_num_threads=1024 -thread_warp_size=32", [-1, 16, 64, 49152, 2147483647, 1024, 8, 32], "", 0, []], [[], [["FU", 1, [0, 1, 2, 3]], ["SP", 1, 0, 4704, [49], 1], ["AN", 1, 0, 5], ["AN", 1, 1, 6]]]], "r": [[2.77996e-06], 0, 1.72238, 1634814433], "v": "v0.6"}
{"i": [["[\"Layer(\\nops=\\nOp0([1, 6, 28, 28])\\nread_graph=()\\nOp1(\\nSpatial\\naxis=(v0:[1], v1:[6], v2:[28], v3:[28])\\nreduce_axis=()\\ncombiner=()\\nsource=(\\ntir.if_then_else((T0[v0, v1, v2, v3] > 0f), T0[v0, v1, v2, v3], 0f))\\n)\\nread_graph=(Op0)\\n)\\n\"]", "cuda -keys=cuda,gpu -max_num_threads=1024 -thread_warp_size=32", [-1, 16, 64, 49152, 2147483647, 1024, 8, 32], "", 0, []], [[], [["FU", 1, [0, 1, 2, 3]], ["SP", 1, 0, 4704, [42], 1], ["AN", 1, 0, 5], ["AN", 1, 1, 6]]]], "r": [[2.5981e-06], 0, 1.31605, 1634814433], "v": "v0.6"}
{"i": [["[\"Layer(\\nops=\\nOp0([1, 6, 28, 28])\\nread_graph=()\\nOp1(\\nSpatial\\naxis=(v0:[1], v1:[6], v2:[28], v3:[28])\\nreduce_axis=()\\ncombiner=()\\nsource=(\\ntir.if_then_else((T0[v0, v1, v2, v3] > 0f), T0[v0, v1, v2, v3], 0f))\\n)\\nread_graph=(Op0)\\n)\\n\"]", "cuda -keys=cuda,gpu -max_num_threads=1024 -thread_warp_size=32", [-1, 16, 64, 49152, 2147483647, 1024, 8, 32], "", 0, []], [[], [["FU", 1, [0, 1, 2, 3]], ["SP", 1, 0, 4704, [4], 1], ["AN", 1, 0, 5], ["AN", 1, 1, 6]]]], "r": [[3.73696e-06], 0, 1.20265, 1634814433], "v": "v0.6"}
{"i": [["[\"Layer(\\nops=\\nOp0([1, 6, 28, 28])\\nread_graph=()\\nOp1(\\nSpatial\\naxis=(v0:[1], v1:[6], v2:[28], v3:[28])\\nreduce_axis=()\\ncombiner=()\\nsource=(\\ntir.if_then_else((T0[v0, v1, v2, v3] > 0f), T0[v0, v1, v2, v3], 0f))\\n)\\nread_graph=(Op0)\\n)\\n\"]", "cuda -keys=cuda,gpu -max_num_threads=1024 -thread_warp_size=32", [-1, 16, 64, 49152, 2147483647, 1024, 8, 32], "", 0, []], [[], [["FU", 1, [0, 1, 2, 3]], ["SP", 1, 0, 4704, [21], 1], ["AN", 1, 0, 5], ["AN", 1, 1, 6]]]], "r": [[3.22645e-06], 0, 1.44742, 1634814434], "v": "v0.6"}
{"i": [["[\"Layer(\\nops=\\nOp0([1, 6, 28, 28])\\nread_graph=()\\nOp1(\\nSpatial\\naxis=(v0:[1], v1:[6], v2:[28], v3:[28])\\nreduce_axis=()\\ncombiner=()\\nsource=(\\ntir.if_then_else((T0[v0, v1, v2, v3] > 0f), T0[v0, v1, v2, v3], 0f))\\n)\\nread_graph=(Op0)\\n)\\n\"]", "cuda -keys=cuda,gpu -max_num_threads=1024 -thread_warp_size=32", [-1, 16, 64, 49152, 2147483647, 1024, 8, 32], "", 0, []], [[], [["FU", 1, [0, 1, 2, 3]], ["SP", 1, 0, 4704, [16], 1], ["AN", 1, 0, 5], ["AN", 1, 1, 6]]]], "r": [[2.61191e-06], 0, 1.38711, 1634814434], "v": "v0.6"}
{"i": [["[\"Layer(\\nops=\\nOp0([1, 6, 28, 28])\\nread_graph=()\\nOp1(\\nSpatial\\naxis=(v0:[1], v1:[6], v2:[28], v3:[28])\\nreduce_axis=()\\ncombiner=()\\nsource=(\\ntir.if_then_else((T0[v0, v1, v2, v3] > 0f), T0[v0, v1, v2, v3], 0f))\\n)\\nread_graph=(Op0)\\n)\\n\"]", "cuda -keys=cuda,gpu -max_num_threads=1024 -thread_warp_size=32", [-1, 16, 64, 49152, 2147483647, 1024, 8, 32], "", 0, []], [[], [["FU", 1, [0, 1, 2, 3]], ["SP", 1, 0, 4704, [3], 1], ["AN", 1, 0, 5], ["AN", 1, 1, 6]]]], "r": [[4.36984e-06], 0, 1.30368, 1634814434], "v": "v0.6"}
{"i": [["[\"Layer(\\nops=\\nOp0([1, 6, 28, 28])\\nread_graph=()\\nOp1(\\nSpatial\\naxis=(v0:[1], v1:[6], v2:[28], v3:[28])\\nreduce_axis=()\\ncombiner=()\\nsource=(\\ntir.if_then_else((T0[v0, v1, v2, v3] > 0f), T0[v0, v1, v2, v3], 0f))\\n)\\nread_graph=(Op0)\\n)\\n\"]", "cuda -keys=cuda,gpu -max_num_threads=1024 -thread_warp_size=32", [-1, 16, 64, 49152, 2147483647, 1024, 8, 32], "", 0, []], [[], [["FU", 1, [0, 1, 2, 3]], ["SP", 1, 0, 4704, [1], 1], ["AN", 1, 0, 5], ["AN", 1, 1, 6]]]], "r": [[9.23953e-06], 0, 1.29145, 1634814435], "v": "v0.6"}
{"i": [["[\"Layer(\\nops=\\nOp0([1, 6, 28, 28])\\nread_graph=()\\nOp1(\\nSpatial\\naxis=(v0:[1], v1:[6], v2:[28], v3:[28])\\nreduce_axis=()\\ncombiner=()\\nsource=(\\ntir.if_then_else((T0[v0, v1, v2, v3] > 0f), T0[v0, v1, v2, v3], 0f))\\n)\\nread_graph=(Op0)\\n)\\n\"]", "cuda -keys=cuda,gpu -max_num_threads=1024 -thread_warp_size=32", [-1, 16, 64, 49152, 2147483647, 1024, 8, 32], "", 0, []], [[], [["FU", 1, [0, 1, 2, 3]], ["SP", 1, 0, 4704, [32], 1], ["AN", 1, 0, 5], ["AN", 1, 1, 6]]]], "r": [[2.62936e-06], 0, 1.45098, 1634814435], "v": "v0.6"}
{"i": [["[\"Layer(\\nops=\\nOp0([1, 6, 28, 28])\\nread_graph=()\\nOp1(\\nSpatial\\naxis=(v0:[1], v1:[6], v2:[28], v3:[28])\\nreduce_axis=()\\ncombiner=()\\nsource=(\\ntir.if_then_else(((((v2 >= 0) && (v2 < 28)) && (v3 >= 0)) && (v3 < 28)), T0[v0, v1, v2, v3], 0f))\\n)\\nread_graph=(Op0)\\nOp2(\\nReduce\\naxis=(v0:[1], v1:[6], v2:[14], v3:[14])\\nreduce_axis=(v4:[2], v5:[2])\\ncombiner=(comm_reducer(result=[(v6 + v7)], lhs=[v6], rhs=[v7], identity_element=[0f]))\\nsource=(\\n(T0[v0, v1, ((v2*2) + v4), ((v3*2) + v5)]/4f))\\n)\\nread_graph=(Op1)\\n)\\n\"]", "cuda -keys=cuda,gpu -max_num_threads=1024 -thread_warp_size=32", [-1, 16, 64, 49152, 2147483647, 1024, 8, 32], "", 0, []], [[], [["CI", 1], ["FU", 2, [0, 1, 2, 3]], ["SP", 2, 0, 1176, [1], 1], ["AN", 2, 0, 5], ["AN", 2, 1, 6], ["PR", 2, 0, "auto_unroll_max_step$512"]]]], "r": [[3.87012e-06], 0, 1.55478, 1634814457], "v": "v0.6"}
{"i": [["[\"Layer(\\nops=\\nOp0([1, 6, 28, 28])\\nread_graph=()\\nOp1(\\nSpatial\\naxis=(v0:[1], v1:[6], v2:[28], v3:[28])\\nreduce_axis=()\\ncombiner=()\\nsource=(\\ntir.if_then_else(((((v2 >= 0) && (v2 < 28)) && (v3 >= 0)) && (v3 < 28)), T0[v0, v1, v2, v3], 0f))\\n)\\nread_graph=(Op0)\\nOp2(\\nReduce\\naxis=(v0:[1], v1:[6], v2:[14], v3:[14])\\nreduce_axis=(v4:[2], v5:[2])\\ncombiner=(comm_reducer(result=[(v6 + v7)], lhs=[v6], rhs=[v7], identity_element=[0f]))\\nsource=(\\n(T0[v0, v1, ((v2*2) + v4), ((v3*2) + v5)]/4f))\\n)\\nread_graph=(Op1)\\n)\\n\"]", "cuda -keys=cuda,gpu -max_num_threads=1024 -thread_warp_size=32", [-1, 16, 64, 49152, 2147483647, 1024, 8, 32], "", 0, []], [[], [["CI", 1], ["FU", 2, [0, 1, 2, 3]], ["SP", 2, 0, 1176, [64], 1], ["AN", 2, 0, 5], ["AN", 2, 1, 6], ["PR", 2, 0, "auto_unroll_max_step$16"]]]], "r": [[2.74128e-06], 0, 1.24517, 1634814458], "v": "v0.6"}
{"i": [["[\"Layer(\\nops=\\nOp0([1, 6, 28, 28])\\nread_graph=()\\nOp1(\\nSpatial\\naxis=(v0:[1], v1:[6], v2:[28], v3:[28])\\nreduce_axis=()\\ncombiner=()\\nsource=(\\ntir.if_then_else(((((v2 >= 0) && (v2 < 28)) && (v3 >= 0)) && (v3 < 28)), T0[v0, v1, v2, v3], 0f))\\n)\\nread_graph=(Op0)\\nOp2(\\nReduce\\naxis=(v0:[1], v1:[6], v2:[14], v3:[14])\\nreduce_axis=(v4:[2], v5:[2])\\ncombiner=(comm_reducer(result=[(v6 + v7)], lhs=[v6], rhs=[v7], identity_element=[0f]))\\nsource=(\\n(T0[v0, v1, ((v2*2) + v4), ((v3*2) + v5)]/4f))\\n)\\nread_graph=(Op1)\\n)\\n\"]", "cuda -keys=cuda,gpu -max_num_threads=1024 -thread_warp_size=32", [-1, 16, 64, 49152, 2147483647, 1024, 8, 32], "", 0, []], [[], [["CI", 1], ["FU", 2, [0, 1, 2, 3]], ["SP", 2, 0, 1176, [8], 1], ["AN", 2, 0, 5], ["AN", 2, 1, 6], ["PR", 2, 0, "auto_unroll_max_step$512"]]]], "r": [[2.65802e-06], 0, 1.29558, 1634814458], "v": "v0.6"}
{"i": [["[\"Layer(\\nops=\\nOp0([1, 6, 28, 28])\\nread_graph=()\\nOp1(\\nSpatial\\naxis=(v0:[1], v1:[6], v2:[28], v3:[28])\\nreduce_axis=()\\ncombiner=()\\nsource=(\\ntir.if_then_else(((((v2 >= 0) && (v2 < 28)) && (v3 >= 0)) && (v3 < 28)), T0[v0, v1, v2, v3], 0f))\\n)\\nread_graph=(Op0)\\nOp2(\\nReduce\\naxis=(v0:[1], v1:[6], v2:[14], v3:[14])\\nreduce_axis=(v4:[2], v5:[2])\\ncombiner=(comm_reducer(result=[(v6 + v7)], lhs=[v6], rhs=[v7], identity_element=[0f]))\\nsource=(\\n(T0[v0, v1, ((v2*2) + v4), ((v3*2) + v5)]/4f))\\n)\\nread_graph=(Op1)\\n)\\n\"]", "cuda -keys=cuda,gpu -max_num_threads=1024 -thread_warp_size=32", [-1, 16, 64, 49152, 2147483647, 1024, 8, 32], "", 0, []], [[], [["CI", 1], ["FU", 2, [0, 1, 2, 3]], ["SP", 2, 0, 1176, [2], 1], ["AN", 2, 0, 5], ["AN", 2, 1, 6], ["PR", 2, 0, "auto_unroll_max_step$0"]]]], "r": [[2.87453e-06], 0, 1.15021, 1634814458], "v": "v0.6"}
{"i": [["[\"Layer(\\nops=\\nOp0([1, 6, 28, 28])\\nread_graph=()\\nOp1(\\nSpatial\\naxis=(v0:[1], v1:[6], v2:[28], v3:[28])\\nreduce_axis=()\\ncombiner=()\\nsource=(\\ntir.if_then_else(((((v2 >= 0) && (v2 < 28)) && (v3 >= 0)) && (v3 < 28)), T0[v0, v1, v2, v3], 0f))\\n)\\nread_graph=(Op0)\\nOp2(\\nReduce\\naxis=(v0:[1], v1:[6], v2:[14], v3:[14])\\nreduce_axis=(v4:[2], v5:[2])\\ncombiner=(comm_reducer(result=[(v6 + v7)], lhs=[v6], rhs=[v7], identity_element=[0f]))\\nsource=(\\n(T0[v0, v1, ((v2*2) + v4), ((v3*2) + v5)]/4f))\\n)\\nread_graph=(Op1)\\n)\\n\"]", "cuda -keys=cuda,gpu -max_num_threads=1024 -thread_warp_size=32", [-1, 16, 64, 49152, 2147483647, 1024, 8, 32], "", 0, []], [[], [["CI", 1], ["FU", 2, [0, 1, 2, 3]], ["SP", 2, 0, 1176, [1], 1], ["AN", 2, 0, 5], ["AN", 2, 1, 6], ["PR", 2, 0, "auto_unroll_max_step$0"]]]], "r": [[3.73196e-06], 0, 1.24254, 1634814459], "v": "v0.6"}
{"i": [["[\"Layer(\\nops=\\nOp0([1, 6, 28, 28])\\nread_graph=()\\nOp1(\\nSpatial\\naxis=(v0:[1], v1:[6], v2:[28], v3:[28])\\nreduce_axis=()\\ncombiner=()\\nsource=(\\ntir.if_then_else(((((v2 >= 0) && (v2 < 28)) && (v3 >= 0)) && (v3 < 28)), T0[v0, v1, v2, v3], 0f))\\n)\\nread_graph=(Op0)\\nOp2(\\nReduce\\naxis=(v0:[1], v1:[6], v2:[14], v3:[14])\\nreduce_axis=(v4:[2], v5:[2])\\ncombiner=(comm_reducer(result=[(v6 + v7)], lhs=[v6], rhs=[v7], identity_element=[0f]))\\nsource=(\\n(T0[v0, v1, ((v2*2) + v4), ((v3*2) + v5)]/4f))\\n)\\nread_graph=(Op1)\\n)\\n\"]", "cuda -keys=cuda,gpu -max_num_threads=1024 -thread_warp_size=32", [-1, 16, 64, 49152, 2147483647, 1024, 8, 32], "", 0, []], [[], [["CI", 1], ["FU", 2, [0, 1, 2, 3]], ["SP", 2, 0, 1176, [56], 1], ["AN", 2, 0, 5], ["AN", 2, 1, 6], ["PR", 2, 0, "auto_unroll_max_step$512"]]]], "r": [[2.66979e-06], 0, 1.51411, 1634814459], "v": "v0.6"}
{"i": [["[\"Layer(\\nops=\\nOp0([1, 6, 28, 28])\\nread_graph=()\\nOp1(\\nSpatial\\naxis=(v0:[1], v1:[6], v2:[28], v3:[28])\\nreduce_axis=()\\ncombiner=()\\nsource=(\\ntir.if_then_else(((((v2 >= 0) && (v2 < 28)) && (v3 >= 0)) && (v3 < 28)), T0[v0, v1, v2, v3], 0f))\\n)\\nread_graph=(Op0)\\nOp2(\\nReduce\\naxis=(v0:[1], v1:[6], v2:[14], v3:[14])\\nreduce_axis=(v4:[2], v5:[2])\\ncombiner=(comm_reducer(result=[(v6 + v7)], lhs=[v6], rhs=[v7], identity_element=[0f]))\\nsource=(\\n(T0[v0, v1, ((v2*2) + v4), ((v3*2) + v5)]/4f))\\n)\\nread_graph=(Op1)\\n)\\n\"]", "cuda -keys=cuda,gpu -max_num_threads=1024 -thread_warp_size=32", [-1, 16, 64, 49152, 2147483647, 1024, 8, 32], "", 0, []], [[], [["CI", 1], ["FU", 2, [0, 1, 2, 3]], ["SP", 2, 0, 1176, [64], 1], ["AN", 2, 0, 5], ["AN", 2, 1, 6], ["PR", 2, 0, "auto_unroll_max_step$512"]]]], "r": [[2.9382e-06], 0, 1.51351, 1634814459], "v": "v0.6"}
{"i": [["[\"Layer(\\nops=\\nOp0([1, 6, 28, 28])\\nread_graph=()\\nOp1(\\nSpatial\\naxis=(v0:[1], v1:[6], v2:[28], v3:[28])\\nreduce_axis=()\\ncombiner=()\\nsource=(\\ntir.if_then_else(((((v2 >= 0) && (v2 < 28)) && (v3 >= 0)) && (v3 < 28)), T0[v0, v1, v2, v3], 0f))\\n)\\nread_graph=(Op0)\\nOp2(\\nReduce\\naxis=(v0:[1], v1:[6], v2:[14], v3:[14])\\nreduce_axis=(v4:[2], v5:[2])\\ncombiner=(comm_reducer(result=[(v6 + v7)], lhs=[v6], rhs=[v7], identity_element=[0f]))\\nsource=(\\n(T0[v0, v1, ((v2*2) + v4), ((v3*2) + v5)]/4f))\\n)\\nread_graph=(Op1)\\n)\\n\"]", "cuda -keys=cuda,gpu -max_num_threads=1024 -thread_warp_size=32", [-1, 16, 64, 49152, 2147483647, 1024, 8, 32], "", 0, []], [[], [["CI", 1], ["FU", 2, [0, 1, 2, 3]], ["SP", 2, 0, 1176, [8], 1], ["AN", 2, 0, 5], ["AN", 2, 1, 6], ["PR", 2, 0, "auto_unroll_max_step$16"]]]], "r": [[2.86096e-06], 0, 1.42012, 1634814460], "v": "v0.6"}
{"i": [["[\"Layer(\\nops=\\nOp0([1, 6, 14, 14])\\nread_graph=()\\nOp1(\\nSpatial\\naxis=(v0:[1], v1:[6], v2:[14], v3:[14])\\nreduce_axis=()\\ncombiner=()\\nsource=(\\nT0[v0, v1, v2, v3])\\n)\\nread_graph=(Op0)\\nOp2([16, 6, 5, 5])\\nread_graph=()\\nOp3(\\nReduce\\naxis=(v0:[1], v1:[16], v2:[10], v3:[10])\\nreduce_axis=(v4:[6], v5:[5], v6:[5])\\ncombiner=(comm_reducer(result=[(v7 + v8)], lhs=[v7], rhs=[v8], identity_element=[0f]))\\nsource=(\\n(T0[v0, v4, (v2 + v5), (v3 + v6)]*T1[v1, v4, v5, v6]))\\n)\\nread_graph=(Op1, Op2)\\n)\\n\"]", "cuda -keys=cuda,gpu -max_num_threads=1024 -thread_warp_size=32", [-1, 16, 64, 49152, 2147483647, 1024, 8, 32], "", 0, []], [[], [["CHW", 3, "local"], ["SP", 3, 0, 1, [1, 1, 1, 1], 1], ["SP", 3, 5, 16, [2, 1, 8, 1], 1], ["SP", 3, 10, 10, [5, 2, 1, 1], 1], ["SP", 3, 15, 10, [1, 10, 1, 1], 1], ["SP", 3, 20, 6, [2, 3], 1], ["SP", 3, 23, 5, [1, 5], 1], ["SP", 3, 26, 5, [1, 5], 1], ["RE", 3, [0, 5, 10, 15, 1, 6, 11, 16, 2, 7, 12, 17, 20, 23, 26, 21, 24, 27, 3, 8, 13, 18, 22, 25, 28, 4, 9, 14, 19]], ["FSP", 4, 0, 1, 3], ["FSP", 4, 4, 2, 3], ["FSP", 4, 8, 3, 3], ["FSP", 4, 12, 4, 3], ["RE", 4, [0, 4, 8, 12, 1, 5, 9, 13, 2, 6, 10, 14, 3, 7, 11, 15]], ["CA", 3, 4, 11], ["CHR", 2, "shared", [3]], ["CA", 3, 4, 14], ["CHR", 1, "shared", [4]], ["CA", 2, 5, 14], ["CI", 1], ["FU", 6, [0, 1, 2, 3]], ["AN", 6, 0, 5], ["FU", 6, [1, 2, 3, 4]], ["AN", 6, 1, 4], ["FU", 6, [2, 3, 4, 5]], ["AN", 6, 2, 6], ["FU", 4, [0, 1, 2, 3]], ["SP", 4, 0, 240, [1], 1], ["AN", 4, 1, 2], ["FFSP", 4, 0, [4, 3, 2, 1], 1, 1], ["AN", 4, 1, 6], ["FU", 2, [0, 1, 2, 3]], ["SP", 2, 0, 30, [1], 1], ["AN", 2, 1, 2], ["FFSP", 2, 0, [4, 3, 2, 1], 1, 1], ["AN", 2, 1, 6], ["PR", 5, 0, "auto_unroll_max_step$1024"]]]], "r": [[4.97366e-05], 0, 3.54658, 1634814472], "v": "v0.6"}
{"i": [["[\"Layer(\\nops=\\nOp0([1, 6, 14, 14])\\nread_graph=()\\nOp1(\\nSpatial\\naxis=(v0:[1], v1:[6], v2:[14], v3:[14])\\nreduce_axis=()\\ncombiner=()\\nsource=(\\nT0[v0, v1, v2, v3])\\n)\\nread_graph=(Op0)\\nOp2([16, 6, 5, 5])\\nread_graph=()\\nOp3(\\nReduce\\naxis=(v0:[1], v1:[16], v2:[10], v3:[10])\\nreduce_axis=(v4:[6], v5:[5], v6:[5])\\ncombiner=(comm_reducer(result=[(v7 + v8)], lhs=[v7], rhs=[v8], identity_element=[0f]))\\nsource=(\\n(T0[v0, v4, (v2 + v5), (v3 + v6)]*T1[v1, v4, v5, v6]))\\n)\\nread_graph=(Op1, Op2)\\n)\\n\"]", "cuda -keys=cuda,gpu -max_num_threads=1024 -thread_warp_size=32", [-1, 16, 64, 49152, 2147483647, 1024, 8, 32], "", 0, []], [[], [["CHW", 3, "local"], ["SP", 3, 0, 1, [1, 1, 1, 1], 1], ["SP", 3, 5, 16, [2, 2, 1, 1], 1], ["SP", 3, 10, 10, [5, 1, 1, 2], 1], ["SP", 3, 15, 10, [1, 5, 1, 1], 1], ["SP", 3, 20, 6, [1, 3], 1], ["SP", 3, 23, 5, [5, 1], 1], ["SP", 3, 26, 5, [1, 5], 1], ["RE", 3, [0, 5, 10, 15, 1, 6, 11, 16, 2, 7, 12, 17, 20, 23, 26, 21, 24, 27, 3, 8, 13, 18, 22, 25, 28, 4, 9, 14, 19]], ["FSP", 4, 0, 1, 3], ["FSP", 4, 4, 2, 3], ["FSP", 4, 8, 3, 3], ["FSP", 4, 12, 4, 3], ["RE", 4, [0, 4, 8, 12, 1, 5, 9, 13, 2, 6, 10, 14, 3, 7, 11, 15]], ["CA", 3, 4, 11], ["CHR", 2, "shared", [3]], ["CA", 3, 4, 14], ["CHR", 1, "shared", [4]], ["CA", 2, 5, 14], ["CI", 1], ["FU", 6, [0, 1, 2, 3]], ["AN", 6, 0, 5], ["FU", 6, [1, 2, 3, 4]], ["AN", 6, 1, 4], ["FU", 6, [2, 3, 4, 5]], ["AN", 6, 2, 6], ["FU", 4, [0, 1, 2, 3]], ["SP", 4, 0, 75, [1], 1], ["AN", 4, 1, 2], ["FFSP", 4, 0, [4, 3, 2, 1], 1, 1], ["AN", 4, 1, 6], ["FU", 2, [0, 1, 2, 3]], ["SP", 2, 0, 90, [1], 1], ["AN", 2, 1, 2], ["FFSP", 2, 0, [4, 3, 2, 1], 1, 1], ["AN", 2, 1, 6], ["PR", 5, 0, "auto_unroll_max_step$64"]]]], "r": [[1.15812e-05], 0, 1.39728, 1634814472], "v": "v0.6"}
{"i": [["[\"Layer(\\nops=\\nOp0([1, 6, 14, 14])\\nread_graph=()\\nOp1(\\nSpatial\\naxis=(v0:[1], v1:[6], v2:[14], v3:[14])\\nreduce_axis=()\\ncombiner=()\\nsource=(\\nT0[v0, v1, v2, v3])\\n)\\nread_graph=(Op0)\\nOp2([16, 6, 5, 5])\\nread_graph=()\\nOp3(\\nReduce\\naxis=(v0:[1], v1:[16], v2:[10], v3:[10])\\nreduce_axis=(v4:[6], v5:[5], v6:[5])\\ncombiner=(comm_reducer(result=[(v7 + v8)], lhs=[v7], rhs=[v8], identity_element=[0f]))\\nsource=(\\n(T0[v0, v4, (v2 + v5), (v3 + v6)]*T1[v1, v4, v5, v6]))\\n)\\nread_graph=(Op1, Op2)\\n)\\n\"]", "cuda -keys=cuda,gpu -max_num_threads=1024 -thread_warp_size=32", [-1, 16, 64, 49152, 2147483647, 1024, 8, 32], "", 0, []], [[], [["CHW", 3, "local"], ["SP", 3, 0, 1, [1, 1, 1, 1], 1], ["SP", 3, 5, 16, [2, 1, 1, 8], 1], ["SP", 3, 10, 10, [1, 5, 1, 2], 1], ["SP", 3, 15, 10, [1, 10, 1, 1], 1], ["SP", 3, 20, 6, [6, 1], 1], ["SP", 3, 23, 5, [1, 1], 1], ["SP", 3, 26, 5, [5, 1], 1], ["RE", 3, [0, 5, 10, 15, 1, 6, 11, 16, 2, 7, 12, 17, 20, 23, 26, 21, 24, 27, 3, 8, 13, 18, 22, 25, 28, 4, 9, 14, 19]], ["FSP", 4, 0, 1, 3], ["FSP", 4, 4, 2, 3], ["FSP", 4, 8, 3, 3], ["FSP", 4, 12, 4, 3], ["RE", 4, [0, 4, 8, 12, 1, 5, 9, 13, 2, 6, 10, 14, 3, 7, 11, 15]], ["CA", 3, 4, 11], ["CHR", 2, "shared", [3]], ["CA", 3, 4, 14], ["CHR", 1, "shared", [4]], ["CA", 2, 5, 14], ["CI", 1], ["FU", 6, [0, 1, 2, 3]], ["AN", 6, 0, 5], ["FU", 6, [1, 2, 3, 4]], ["AN", 6, 1, 4], ["FU", 6, [2, 3, 4, 5]], ["AN", 6, 2, 6], ["FU", 4, [0, 1, 2, 3]], ["SP", 4, 0, 240, [1], 1], ["AN", 4, 1, 2], ["FFSP", 4, 0, [4, 3, 2, 1], 1, 1], ["AN", 4, 1, 6], ["FU", 2, [0, 1, 2, 3]], ["SP", 2, 0, 60, [12], 1], ["AN", 2, 1, 2], ["FFSP", 2, 0, [4, 3, 2, 1], 1, 1], ["AN", 2, 1, 6], ["PR", 5, 0, "auto_unroll_max_step$0"]]]], "r": [[2.11581e-05], 0, 1.69646, 1634814473], "v": "v0.6"}
{"i": [["[\"Layer(\\nops=\\nOp0([1, 6, 14, 14])\\nread_graph=()\\nOp1(\\nSpatial\\naxis=(v0:[1], v1:[6], v2:[14], v3:[14])\\nreduce_axis=()\\ncombiner=()\\nsource=(\\nT0[v0, v1, v2, v3])\\n)\\nread_graph=(Op0)\\nOp2([16, 6, 5, 5])\\nread_graph=()\\nOp3(\\nReduce\\naxis=(v0:[1], v1:[16], v2:[10], v3:[10])\\nreduce_axis=(v4:[6], v5:[5], v6:[5])\\ncombiner=(comm_reducer(result=[(v7 + v8)], lhs=[v7], rhs=[v8], identity_element=[0f]))\\nsource=(\\n(T0[v0, v4, (v2 + v5), (v3 + v6)]*T1[v1, v4, v5, v6]))\\n)\\nread_graph=(Op1, Op2)\\n)\\n\"]", "cuda -keys=cuda,gpu -max_num_threads=1024 -thread_warp_size=32", [-1, 16, 64, 49152, 2147483647, 1024, 8, 32], "", 0, []], [[], [["CHW", 3, "local"], ["SP", 3, 0, 1, [1, 1, 1, 1], 1], ["SP", 3, 5, 16, [1, 8, 1, 1], 1], ["SP", 3, 10, 10, [1, 1, 5, 1], 1], ["SP", 3, 15, 10, [1, 5, 1, 2], 1], ["SP", 3, 20, 6, [2, 1], 1], ["SP", 3, 23, 5, [1, 5], 1], ["SP", 3, 26, 5, [5, 1], 1], ["RE", 3, [0, 5, 10, 15, 1, 6, 11, 16, 2, 7, 12, 17, 20, 23, 26, 21, 24, 27, 3, 8, 13, 18, 22, 25, 28, 4, 9, 14, 19]], ["FSP", 4, 0, 1, 3], ["FSP", 4, 4, 2, 3], ["FSP", 4, 8, 3, 3], ["FSP", 4, 12, 4, 3], ["RE", 4, [0, 4, 8, 12, 1, 5, 9, 13, 2, 6, 10, 14, 3, 7, 11, 15]], ["CA", 3, 4, 11], ["CHR", 2, "shared", [3]], ["CA", 3, 4, 14], ["CHR", 1, "shared", [4]], ["CA", 2, 5, 14], ["CI", 1], ["FU", 6, [0, 1, 2, 3]], ["AN", 6, 0, 5], ["FU", 6, [1, 2, 3, 4]], ["AN", 6, 1, 4], ["FU", 6, [2, 3, 4, 5]], ["AN", 6, 2, 6], ["FU", 4, [0, 1, 2, 3]], ["SP", 4, 0, 100, [20], 1], ["AN", 4, 1, 2], ["FFSP", 4, 0, [4, 3, 2, 1], 1, 1], ["AN", 4, 1, 6], ["FU", 2, [0, 1, 2, 3]], ["SP", 2, 0, 108, [1], 1], ["AN", 2, 1, 2], ["FFSP", 2, 0, [4, 3, 2, 1], 1, 1], ["AN", 2, 1, 6], ["PR", 5, 0, "auto_unroll_max_step$1024"]]]], "r": [[6.40037e-06], 0, 1.77074, 1634814474], "v": "v0.6"}
{"i": [["[\"Layer(\\nops=\\nOp0([1, 6, 14, 14])\\nread_graph=()\\nOp1(\\nSpatial\\naxis=(v0:[1], v1:[6], v2:[14], v3:[14])\\nreduce_axis=()\\ncombiner=()\\nsource=(\\nT0[v0, v1, v2, v3])\\n)\\nread_graph=(Op0)\\nOp2([16, 6, 5, 5])\\nread_graph=()\\nOp3(\\nReduce\\naxis=(v0:[1], v1:[16], v2:[10], v3:[10])\\nreduce_axis=(v4:[6], v5:[5], v6:[5])\\ncombiner=(comm_reducer(result=[(v7 + v8)], lhs=[v7], rhs=[v8], identity_element=[0f]))\\nsource=(\\n(T0[v0, v4, (v2 + v5), (v3 + v6)]*T1[v1, v4, v5, v6]))\\n)\\nread_graph=(Op1, Op2)\\n)\\n\"]", "cuda -keys=cuda,gpu -max_num_threads=1024 -thread_warp_size=32", [-1, 16, 64, 49152, 2147483647, 1024, 8, 32], "", 0, []], [[], [["CHW", 3, "local"], ["SP", 3, 0, 1, [1, 1, 1, 1], 1], ["SP", 3, 5, 16, [1, 2, 1, 2], 1], ["SP", 3, 10, 10, [1, 5, 1, 2], 1], ["SP", 3, 15, 10, [1, 10, 1, 1], 1], ["SP", 3, 20, 6, [6, 1], 1], ["SP", 3, 23, 5, [1, 1], 1], ["SP", 3, 26, 5, [1, 5], 1], ["RE", 3, [0, 5, 10, 15, 1, 6, 11, 16, 2, 7, 12, 17, 20, 23, 26, 21, 24, 27, 3, 8, 13, 18, 22, 25, 28, 4, 9, 14, 19]], ["FSP", 4, 0, 1, 3], ["FSP", 4, 4, 2, 3], ["FSP", 4, 8, 3, 3], ["FSP", 4, 12, 4, 3], ["RE", 4, [0, 4, 8, 12, 1, 5, 9, 13, 2, 6, 10, 14, 3, 7, 11, 15]], ["CA", 3, 4, 11], ["CHR", 2, "shared", [3]], ["CA", 3, 4, 14], ["CHR", 1, "shared", [4]], ["CA", 2, 5, 14], ["CI", 1], ["FU", 6, [0, 1, 2, 3]], ["AN", 6, 0, 5], ["FU", 6, [1, 2, 3, 4]], ["AN", 6, 1, 4], ["FU", 6, [2, 3, 4, 5]], ["AN", 6, 2, 6], ["FU", 4, [0, 1, 2, 3]], ["SP", 4, 0, 60, [12], 1], ["AN", 4, 1, 2], ["FFSP", 4, 0, [4, 3, 2, 1], 1, 1], ["AN", 4, 1, 6], ["FU", 2, [0, 1, 2, 3]], ["SP", 2, 0, 36, [1], 1], ["AN", 2, 1, 2], ["FFSP", 2, 0, [4, 3, 2, 1], 1, 1], ["AN", 2, 1, 6], ["PR", 5, 0, "auto_unroll_max_step$1024"]]]], "r": [[7.62999e-06], 0, 2.19713, 1634814474], "v": "v0.6"}
{"i": [["[\"Layer(\\nops=\\nOp0([1, 6, 14, 14])\\nread_graph=()\\nOp1(\\nSpatial\\naxis=(v0:[1], v1:[6], v2:[14], v3:[14])\\nreduce_axis=()\\ncombiner=()\\nsource=(\\nT0[v0, v1, v2, v3])\\n)\\nread_graph=(Op0)\\nOp2([16, 6, 5, 5])\\nread_graph=()\\nOp3(\\nReduce\\naxis=(v0:[1], v1:[16], v2:[10], v3:[10])\\nreduce_axis=(v4:[6], v5:[5], v6:[5])\\ncombiner=(comm_reducer(result=[(v7 + v8)], lhs=[v7], rhs=[v8], identity_element=[0f]))\\nsource=(\\n(T0[v0, v4, (v2 + v5), (v3 + v6)]*T1[v1, v4, v5, v6]))\\n)\\nread_graph=(Op1, Op2)\\n)\\n\"]", "cuda -keys=cuda,gpu -max_num_threads=1024 -thread_warp_size=32", [-1, 16, 64, 49152, 2147483647, 1024, 8, 32], "", 0, []], [[], [["CHW", 3, "local"], ["SP", 3, 0, 1, [1, 1, 1, 1], 1], ["SP", 3, 5, 16, [1, 2, 1, 2], 1], ["SP", 3, 10, 10, [1, 5, 1, 2], 1], ["SP", 3, 15, 10, [1, 10, 1, 1], 1], ["SP", 3, 20, 6, [6, 1], 1], ["SP", 3, 23, 5, [5, 1], 1], ["SP", 3, 26, 5, [1, 1], 1], ["RE", 3, [0, 5, 10, 15, 1, 6, 11, 16, 2, 7, 12, 17, 20, 23, 26, 21, 24, 27, 3, 8, 13, 18, 22, 25, 28, 4, 9, 14, 19]], ["FSP", 4, 0, 1, 3], ["FSP", 4, 4, 2, 3], ["FSP", 4, 8, 3, 3], ["FSP", 4, 12, 4, 3], ["RE", 4, [0, 4, 8, 12, 1, 5, 9, 13, 2, 6, 10, 14, 3, 7, 11, 15]], ["CA", 3, 4, 11], ["CHR", 2, "shared", [3]], ["CA", 3, 4, 14], ["CHR", 1, "shared", [4]], ["CA", 2, 5, 14], ["CI", 1], ["FU", 6, [0, 1, 2, 3]], ["AN", 6, 0, 5], ["FU", 6, [1, 2, 3, 4]], ["AN", 6, 1, 4], ["FU", 6, [2, 3, 4, 5]], ["AN", 6, 2, 6], ["FU", 4, [0, 1, 2, 3]], ["SP", 4, 0, 60, [1], 1], ["AN", 4, 1, 2], ["FFSP", 4, 0, [4, 3, 2, 1], 1, 1], ["AN", 4, 1, 6], ["FU", 2, [0, 1, 2, 3]], ["SP", 2, 0, 36, [4], 1], ["AN", 2, 1, 2], ["FFSP", 2, 0, [4, 3, 2, 1], 1, 1], ["AN", 2, 1, 6], ["PR", 5, 0, "auto_unroll_max_step$1024"]]]], "r": [[6.95367e-06], 0, 2.25046, 1634814475], "v": "v0.6"}
{"i": [["[\"Layer(\\nops=\\nOp0([1, 6, 14, 14])\\nread_graph=()\\nOp1(\\nSpatial\\naxis=(v0:[1], v1:[6], v2:[14], v3:[14])\\nreduce_axis=()\\ncombiner=()\\nsource=(\\nT0[v0, v1, v2, v3])\\n)\\nread_graph=(Op0)\\nOp2([16, 6, 5, 5])\\nread_graph=()\\nOp3(\\nReduce\\naxis=(v0:[1], v1:[16], v2:[10], v3:[10])\\nreduce_axis=(v4:[6], v5:[5], v6:[5])\\ncombiner=(comm_reducer(result=[(v7 + v8)], lhs=[v7], rhs=[v8], identity_element=[0f]))\\nsource=(\\n(T0[v0, v4, (v2 + v5), (v3 + v6)]*T1[v1, v4, v5, v6]))\\n)\\nread_graph=(Op1, Op2)\\n)\\n\"]", "cuda -keys=cuda,gpu -max_num_threads=1024 -thread_warp_size=32", [-1, 16, 64, 49152, 2147483647, 1024, 8, 32], "", 0, []], [[], [["CHW", 3, "local"], ["SP", 3, 0, 1, [1, 1, 1, 1], 1], ["SP", 3, 5, 16, [1, 16, 1, 1], 1], ["SP", 3, 10, 10, [5, 2, 1, 1], 1], ["SP", 3, 15, 10, [1, 5, 2, 1], 1], ["SP", 3, 20, 6, [3, 1], 1], ["SP", 3, 23, 5, [5, 1], 1], ["SP", 3, 26, 5, [1, 1], 1], ["RE", 3, [0, 5, 10, 15, 1, 6, 11, 16, 2, 7, 12, 17, 20, 23, 26, 21, 24, 27, 3, 8, 13, 18, 22, 25, 28, 4, 9, 14, 19]], ["FSP", 4, 0, 1, 3], ["FSP", 4, 4, 2, 3], ["FSP", 4, 8, 3, 3], ["FSP", 4, 12, 4, 3], ["RE", 4, [0, 4, 8, 12, 1, 5, 9, 13, 2, 6, 10, 14, 3, 7, 11, 15]], ["CA", 3, 4, 11], ["CHR", 2, "shared", [3]], ["CA", 3, 4, 14], ["CHR", 1, "shared", [4]], ["CA", 2, 5, 14], ["CI", 1], ["FU", 6, [0, 1, 2, 3]], ["AN", 6, 0, 5], ["FU", 6, [1, 2, 3, 4]], ["AN", 6, 1, 4], ["FU", 6, [2, 3, 4, 5]], ["AN", 6, 2, 6], ["FU", 4, [0, 1, 2, 3]], ["SP", 4, 0, 15, [1], 1], ["AN", 4, 1, 2], ["FFSP", 4, 0, [4, 3, 2, 1], 1, 1], ["AN", 4, 1, 6], ["FU", 2, [0, 1, 2, 3]], ["SP", 2, 0, 150, [1], 1], ["AN", 2, 1, 2], ["FFSP", 2, 0, [4, 3, 2, 1], 1, 1], ["AN", 2, 1, 6], ["PR", 5, 0, "auto_unroll_max_step$0"]]]], "r": [[1.03952e-05], 0, 1.54955, 1634814475], "v": "v0.6"}
{"i": [["[\"Layer(\\nops=\\nOp0([1, 6, 14, 14])\\nread_graph=()\\nOp1(\\nSpatial\\naxis=(v0:[1], v1:[6], v2:[14], v3:[14])\\nreduce_axis=()\\ncombiner=()\\nsource=(\\nT0[v0, v1, v2, v3])\\n)\\nread_graph=(Op0)\\nOp2([16, 6, 5, 5])\\nread_graph=()\\nOp3(\\nReduce\\naxis=(v0:[1], v1:[16], v2:[10], v3:[10])\\nreduce_axis=(v4:[6], v5:[5], v6:[5])\\ncombiner=(comm_reducer(result=[(v7 + v8)], lhs=[v7], rhs=[v8], identity_element=[0f]))\\nsource=(\\n(T0[v0, v4, (v2 + v5), (v3 + v6)]*T1[v1, v4, v5, v6]))\\n)\\nread_graph=(Op1, Op2)\\n)\\n\"]", "cuda -keys=cuda,gpu -max_num_threads=1024 -thread_warp_size=32", [-1, 16, 64, 49152, 2147483647, 1024, 8, 32], "", 0, []], [[], [["CHW", 3, "local"], ["SP", 3, 0, 1, [1, 1, 1, 1], 1], ["SP", 3, 5, 16, [1, 8, 2, 1], 1], ["SP", 3, 10, 10, [1, 2, 5, 1], 1], ["SP", 3, 15, 10, [2, 5, 1, 1], 1], ["SP", 3, 20, 6, [2, 3], 1], ["SP", 3, 23, 5, [1, 1], 1], ["SP", 3, 26, 5, [5, 1], 1], ["RE", 3, [0, 5, 10, 15, 1, 6, 11, 16, 2, 7, 12, 17, 20, 23, 26, 21, 24, 27, 3, 8, 13, 18, 22, 25, 28, 4, 9, 14, 19]], ["FSP", 4, 0, 1, 3], ["FSP", 4, 4, 2, 3], ["FSP", 4, 8, 3, 3], ["FSP", 4, 12, 4, 3], ["RE", 4, [0, 4, 8, 12, 1, 5, 9, 13, 2, 6, 10, 14, 3, 7, 11, 15]], ["CA", 3, 4, 11], ["CHR", 2, "shared", [3]], ["CA", 3, 4, 14], ["CHR", 1, "shared", [4]], ["CA", 2, 5, 14], ["CI", 1], ["FU", 6, [0, 1, 2, 3]], ["AN", 6, 0, 5], ["FU", 6, [1, 2, 3, 4]], ["AN", 6, 1, 4], ["FU", 6, [2, 3, 4, 5]], ["AN", 6, 2, 6], ["FU", 4, [0, 1, 2, 3]], ["SP", 4, 0, 60, [1], 1], ["AN", 4, 1, 2], ["FFSP", 4, 0, [4, 3, 2, 1], 1, 1], ["AN", 4, 1, 6], ["FU", 2, [0, 1, 2, 3]], ["SP", 2, 0, 150, [5], 1], ["AN", 2, 1, 2], ["FFSP", 2, 0, [4, 3, 2, 1], 1, 1], ["AN", 2, 1, 6], ["PR", 5, 0, "auto_unroll_max_step$64"]]]], "r": [[1.26898e-05], 0, 1.57902, 1634814476], "v": "v0.6"}
{"i": [["[\"Layer(\\nops=\\nOp0([1, 16, 10, 10])\\nread_graph=()\\nOp1(\\nSpatial\\naxis=(v0:[1], v1:[16], v2:[10], v3:[10])\\nreduce_axis=()\\ncombiner=()\\nsource=(\\ntir.if_then_else((T0[v0, v1, v2, v3] > 0f), T0[v0, v1, v2, v3], 0f))\\n)\\nread_graph=(Op0)\\n)\\n\"]", "cuda -keys=cuda,gpu -max_num_threads=1024 -thread_warp_size=32", [-1, 16, 64, 49152, 2147483647, 1024, 8, 32], "", 0, []], [[], [["FU", 1, [0, 1, 2, 3]], ["SP", 1, 0, 1600, [40], 1], ["AN", 1, 0, 5], ["AN", 1, 1, 6]]]], "r": [[2.58663e-06], 0, 1.60456, 1634814493], "v": "v0.6"}
{"i": [["[\"Layer(\\nops=\\nOp0([1, 16, 10, 10])\\nread_graph=()\\nOp1(\\nSpatial\\naxis=(v0:[1], v1:[16], v2:[10], v3:[10])\\nreduce_axis=()\\ncombiner=()\\nsource=(\\ntir.if_then_else((T0[v0, v1, v2, v3] > 0f), T0[v0, v1, v2, v3], 0f))\\n)\\nread_graph=(Op0)\\n)\\n\"]", "cuda -keys=cuda,gpu -max_num_threads=1024 -thread_warp_size=32", [-1, 16, 64, 49152, 2147483647, 1024, 8, 32], "", 0, []], [[], [["FU", 1, [0, 1, 2, 3]], ["SP", 1, 0, 1600, [8], 1], ["AN", 1, 0, 5], ["AN", 1, 1, 6]]]], "r": [[2.64905e-06], 0, 1.49343, 1634814494], "v": "v0.6"}
{"i": [["[\"Layer(\\nops=\\nOp0([1, 16, 10, 10])\\nread_graph=()\\nOp1(\\nSpatial\\naxis=(v0:[1], v1:[16], v2:[10], v3:[10])\\nreduce_axis=()\\ncombiner=()\\nsource=(\\ntir.if_then_else((T0[v0, v1, v2, v3] > 0f), T0[v0, v1, v2, v3], 0f))\\n)\\nread_graph=(Op0)\\n)\\n\"]", "cuda -keys=cuda,gpu -max_num_threads=1024 -thread_warp_size=32", [-1, 16, 64, 49152, 2147483647, 1024, 8, 32], "", 0, []], [[], [["FU", 1, [0, 1, 2, 3]], ["SP", 1, 0, 1600, [1], 1], ["AN", 1, 0, 5], ["AN", 1, 1, 6]]]], "r": [[4.35079e-06], 0, 1.45369, 1634814494], "v": "v0.6"}
{"i": [["[\"Layer(\\nops=\\nOp0([1, 16, 10, 10])\\nread_graph=()\\nOp1(\\nSpatial\\naxis=(v0:[1], v1:[16], v2:[10], v3:[10])\\nreduce_axis=()\\ncombiner=()\\nsource=(\\ntir.if_then_else((T0[v0, v1, v2, v3] > 0f), T0[v0, v1, v2, v3], 0f))\\n)\\nread_graph=(Op0)\\n)\\n\"]", "cuda -keys=cuda,gpu -max_num_threads=1024 -thread_warp_size=32", [-1, 16, 64, 49152, 2147483647, 1024, 8, 32], "", 0, []], [[], [["FU", 1, [0, 1, 2, 3]], ["SP", 1, 0, 1600, [2], 1], ["AN", 1, 0, 5], ["AN", 1, 1, 6]]]], "r": [[3.06979e-06], 0, 1.43136, 1634814494], "v": "v0.6"}
{"i": [["[\"Layer(\\nops=\\nOp0([1, 16, 10, 10])\\nread_graph=()\\nOp1(\\nSpatial\\naxis=(v0:[1], v1:[16], v2:[10], v3:[10])\\nreduce_axis=()\\ncombiner=()\\nsource=(\\ntir.if_then_else((T0[v0, v1, v2, v3] > 0f), T0[v0, v1, v2, v3], 0f))\\n)\\nread_graph=(Op0)\\n)\\n\"]", "cuda -keys=cuda,gpu -max_num_threads=1024 -thread_warp_size=32", [-1, 16, 64, 49152, 2147483647, 1024, 8, 32], "", 0, []], [[], [["FU", 1, [0, 1, 2, 3]], ["SP", 1, 0, 1600, [16], 1], ["AN", 1, 0, 5], ["AN", 1, 1, 6]]]], "r": [[2.66472e-06], 0, 1.39671, 1634814495], "v": "v0.6"}
{"i": [["[\"Layer(\\nops=\\nOp0([1, 16, 10, 10])\\nread_graph=()\\nOp1(\\nSpatial\\naxis=(v0:[1], v1:[16], v2:[10], v3:[10])\\nreduce_axis=()\\ncombiner=()\\nsource=(\\ntir.if_then_else((T0[v0, v1, v2, v3] > 0f), T0[v0, v1, v2, v3], 0f))\\n)\\nread_graph=(Op0)\\n)\\n\"]", "cuda -keys=cuda,gpu -max_num_threads=1024 -thread_warp_size=32", [-1, 16, 64, 49152, 2147483647, 1024, 8, 32], "", 0, []], [[], [["FU", 1, [0, 1, 2, 3]], ["SP", 1, 0, 1600, [4], 1], ["AN", 1, 0, 5], ["AN", 1, 1, 6]]]], "r": [[2.59707e-06], 0, 1.42371, 1634814495], "v": "v0.6"}
{"i": [["[\"Layer(\\nops=\\nOp0([1, 16, 10, 10])\\nread_graph=()\\nOp1(\\nSpatial\\naxis=(v0:[1], v1:[16], v2:[10], v3:[10])\\nreduce_axis=()\\ncombiner=()\\nsource=(\\ntir.if_then_else((T0[v0, v1, v2, v3] > 0f), T0[v0, v1, v2, v3], 0f))\\n)\\nread_graph=(Op0)\\n)\\n\"]", "cuda -keys=cuda,gpu -max_num_threads=1024 -thread_warp_size=32", [-1, 16, 64, 49152, 2147483647, 1024, 8, 32], "", 0, []], [[], [["FU", 1, [0, 1, 2, 3]], ["SP", 1, 0, 1600, [50], 1], ["AN", 1, 0, 5], ["AN", 1, 1, 6]]]], "r": [[2.65298e-06], 0, 1.43242, 1634814496], "v": "v0.6"}
{"i": [["[\"Layer(\\nops=\\nOp0([1, 16, 10, 10])\\nread_graph=()\\nOp1(\\nSpatial\\naxis=(v0:[1], v1:[16], v2:[10], v3:[10])\\nreduce_axis=()\\ncombiner=()\\nsource=(\\ntir.if_then_else((T0[v0, v1, v2, v3] > 0f), T0[v0, v1, v2, v3], 0f))\\n)\\nread_graph=(Op0)\\n)\\n\"]", "cuda -keys=cuda,gpu -max_num_threads=1024 -thread_warp_size=32", [-1, 16, 64, 49152, 2147483647, 1024, 8, 32], "", 0, []], [[], [["FU", 1, [0, 1, 2, 3]], ["SP", 1, 0, 1600, [20], 1], ["AN", 1, 0, 5], ["AN", 1, 1, 6]]]], "r": [[2.59114e-06], 0, 1.6044, 1634814496], "v": "v0.6"}
{"i": [["[\"Layer(\\nops=\\nOp0([1, 16, 10, 10])\\nread_graph=()\\nOp1(\\nSpatial\\naxis=(v0:[1], v1:[16], v2:[10], v3:[10])\\nreduce_axis=()\\ncombiner=()\\nsource=(\\ntir.if_then_else(((((v2 >= 0) && (v2 < 10)) && (v3 >= 0)) && (v3 < 10)), T0[v0, v1, v2, v3], 0f))\\n)\\nread_graph=(Op0)\\nOp2(\\nReduce\\naxis=(v0:[1], v1:[16], v2:[5], v3:[5])\\nreduce_axis=(v4:[2], v5:[2])\\ncombiner=(comm_reducer(result=[(v6 + v7)], lhs=[v6], rhs=[v7], identity_element=[0f]))\\nsource=(\\n(T0[v0, v1, ((v2*2) + v4), ((v3*2) + v5)]/4f))\\n)\\nread_graph=(Op1)\\n)\\n\"]", "cuda -keys=cuda,gpu -max_num_threads=1024 -thread_warp_size=32", [-1, 16, 64, 49152, 2147483647, 1024, 8, 32], "", 0, []], [[], [["CI", 1], ["FU", 2, [0, 1, 2, 3]], ["SP", 2, 0, 400, [64], 1], ["AN", 2, 0, 5], ["AN", 2, 1, 6], ["PR", 2, 0, "auto_unroll_max_step$0"]]]], "r": [[2.34028e-06], 0, 1.6008, 1634814518], "v": "v0.6"}
{"i": [["[\"Layer(\\nops=\\nOp0([1, 16, 10, 10])\\nread_graph=()\\nOp1(\\nSpatial\\naxis=(v0:[1], v1:[16], v2:[10], v3:[10])\\nreduce_axis=()\\ncombiner=()\\nsource=(\\ntir.if_then_else(((((v2 >= 0) && (v2 < 10)) && (v3 >= 0)) && (v3 < 10)), T0[v0, v1, v2, v3], 0f))\\n)\\nread_graph=(Op0)\\nOp2(\\nReduce\\naxis=(v0:[1], v1:[16], v2:[5], v3:[5])\\nreduce_axis=(v4:[2], v5:[2])\\ncombiner=(comm_reducer(result=[(v6 + v7)], lhs=[v6], rhs=[v7], identity_element=[0f]))\\nsource=(\\n(T0[v0, v1, ((v2*2) + v4), ((v3*2) + v5)]/4f))\\n)\\nread_graph=(Op1)\\n)\\n\"]", "cuda -keys=cuda,gpu -max_num_threads=1024 -thread_warp_size=32", [-1, 16, 64, 49152, 2147483647, 1024, 8, 32], "", 0, []], [[], [["CI", 1], ["FU", 2, [0, 1, 2, 3]], ["SP", 2, 0, 400, [8], 1], ["AN", 2, 0, 5], ["AN", 2, 1, 6], ["PR", 2, 0, "auto_unroll_max_step$0"]]]], "r": [[3.15401e-06], 0, 1.4448, 1634814518], "v": "v0.6"}
{"i": [["[\"Layer(\\nops=\\nOp0([1, 16, 10, 10])\\nread_graph=()\\nOp1(\\nSpatial\\naxis=(v0:[1], v1:[16], v2:[10], v3:[10])\\nreduce_axis=()\\ncombiner=()\\nsource=(\\ntir.if_then_else(((((v2 >= 0) && (v2 < 10)) && (v3 >= 0)) && (v3 < 10)), T0[v0, v1, v2, v3], 0f))\\n)\\nread_graph=(Op0)\\nOp2(\\nReduce\\naxis=(v0:[1], v1:[16], v2:[5], v3:[5])\\nreduce_axis=(v4:[2], v5:[2])\\ncombiner=(comm_reducer(result=[(v6 + v7)], lhs=[v6], rhs=[v7], identity_element=[0f]))\\nsource=(\\n(T0[v0, v1, ((v2*2) + v4), ((v3*2) + v5)]/4f))\\n)\\nread_graph=(Op1)\\n)\\n\"]", "cuda -keys=cuda,gpu -max_num_threads=1024 -thread_warp_size=32", [-1, 16, 64, 49152, 2147483647, 1024, 8, 32], "", 0, []], [[], [["CI", 1], ["FU", 2, [0, 1, 2, 3]], ["SP", 2, 0, 400, [2], 1], ["AN", 2, 0, 5], ["AN", 2, 1, 6], ["PR", 2, 0, "auto_unroll_max_step$64"]]]], "r": [[3.16073e-06], 0, 1.37251, 1634814519], "v": "v0.6"}
{"i": [["[\"Layer(\\nops=\\nOp0([1, 16, 10, 10])\\nread_graph=()\\nOp1(\\nSpatial\\naxis=(v0:[1], v1:[16], v2:[10], v3:[10])\\nreduce_axis=()\\ncombiner=()\\nsource=(\\ntir.if_then_else(((((v2 >= 0) && (v2 < 10)) && (v3 >= 0)) && (v3 < 10)), T0[v0, v1, v2, v3], 0f))\\n)\\nread_graph=(Op0)\\nOp2(\\nReduce\\naxis=(v0:[1], v1:[16], v2:[5], v3:[5])\\nreduce_axis=(v4:[2], v5:[2])\\ncombiner=(comm_reducer(result=[(v6 + v7)], lhs=[v6], rhs=[v7], identity_element=[0f]))\\nsource=(\\n(T0[v0, v1, ((v2*2) + v4), ((v3*2) + v5)]/4f))\\n)\\nread_graph=(Op1)\\n)\\n\"]", "cuda -keys=cuda,gpu -max_num_threads=1024 -thread_warp_size=32", [-1, 16, 64, 49152, 2147483647, 1024, 8, 32], "", 0, []], [[], [["CI", 1], ["FU", 2, [0, 1, 2, 3]], ["SP", 2, 0, 400, [1], 1], ["AN", 2, 0, 5], ["AN", 2, 1, 6], ["PR", 2, 0, "auto_unroll_max_step$64"]]]], "r": [[2.46782e-06], 0, 1.48586, 1634814519], "v": "v0.6"}
{"i": [["[\"Layer(\\nops=\\nOp0([1, 16, 10, 10])\\nread_graph=()\\nOp1(\\nSpatial\\naxis=(v0:[1], v1:[16], v2:[10], v3:[10])\\nreduce_axis=()\\ncombiner=()\\nsource=(\\ntir.if_then_else(((((v2 >= 0) && (v2 < 10)) && (v3 >= 0)) && (v3 < 10)), T0[v0, v1, v2, v3], 0f))\\n)\\nread_graph=(Op0)\\nOp2(\\nReduce\\naxis=(v0:[1], v1:[16], v2:[5], v3:[5])\\nreduce_axis=(v4:[2], v5:[2])\\ncombiner=(comm_reducer(result=[(v6 + v7)], lhs=[v6], rhs=[v7], identity_element=[0f]))\\nsource=(\\n(T0[v0, v1, ((v2*2) + v4), ((v3*2) + v5)]/4f))\\n)\\nread_graph=(Op1)\\n)\\n\"]", "cuda -keys=cuda,gpu -max_num_threads=1024 -thread_warp_size=32", [-1, 16, 64, 49152, 2147483647, 1024, 8, 32], "", 0, []], [[], [["CI", 1], ["FU", 2, [0, 1, 2, 3]], ["SP", 2, 0, 400, [16], 1], ["AN", 2, 0, 5], ["AN", 2, 1, 6], ["PR", 2, 0, "auto_unroll_max_step$1024"]]]], "r": [[2.79589e-06], 0, 1.30117, 1634814520], "v": "v0.6"}
{"i": [["[\"Layer(\\nops=\\nOp0([1, 16, 10, 10])\\nread_graph=()\\nOp1(\\nSpatial\\naxis=(v0:[1], v1:[16], v2:[10], v3:[10])\\nreduce_axis=()\\ncombiner=()\\nsource=(\\ntir.if_then_else(((((v2 >= 0) && (v2 < 10)) && (v3 >= 0)) && (v3 < 10)), T0[v0, v1, v2, v3], 0f))\\n)\\nread_graph=(Op0)\\nOp2(\\nReduce\\naxis=(v0:[1], v1:[16], v2:[5], v3:[5])\\nreduce_axis=(v4:[2], v5:[2])\\ncombiner=(comm_reducer(result=[(v6 + v7)], lhs=[v6], rhs=[v7], identity_element=[0f]))\\nsource=(\\n(T0[v0, v1, ((v2*2) + v4), ((v3*2) + v5)]/4f))\\n)\\nread_graph=(Op1)\\n)\\n\"]", "cuda -keys=cuda,gpu -max_num_threads=1024 -thread_warp_size=32", [-1, 16, 64, 49152, 2147483647, 1024, 8, 32], "", 0, []], [[], [["CI", 1], ["FU", 2, [0, 1, 2, 3]], ["SP", 2, 0, 400, [50], 1], ["AN", 2, 0, 5], ["AN", 2, 1, 6], ["PR", 2, 0, "auto_unroll_max_step$512"]]]], "r": [[2.31931e-06], 0, 1.58116, 1634814520], "v": "v0.6"}
{"i": [["[\"Layer(\\nops=\\nOp0([1, 16, 10, 10])\\nread_graph=()\\nOp1(\\nSpatial\\naxis=(v0:[1], v1:[16], v2:[10], v3:[10])\\nreduce_axis=()\\ncombiner=()\\nsource=(\\ntir.if_then_else(((((v2 >= 0) && (v2 < 10)) && (v3 >= 0)) && (v3 < 10)), T0[v0, v1, v2, v3], 0f))\\n)\\nread_graph=(Op0)\\nOp2(\\nReduce\\naxis=(v0:[1], v1:[16], v2:[5], v3:[5])\\nreduce_axis=(v4:[2], v5:[2])\\ncombiner=(comm_reducer(result=[(v6 + v7)], lhs=[v6], rhs=[v7], identity_element=[0f]))\\nsource=(\\n(T0[v0, v1, ((v2*2) + v4), ((v3*2) + v5)]/4f))\\n)\\nread_graph=(Op1)\\n)\\n\"]", "cuda -keys=cuda,gpu -max_num_threads=1024 -thread_warp_size=32", [-1, 16, 64, 49152, 2147483647, 1024, 8, 32], "", 0, []], [[], [["CI", 1], ["FU", 2, [0, 1, 2, 3]], ["SP", 2, 0, 400, [40], 1], ["AN", 2, 0, 5], ["AN", 2, 1, 6], ["PR", 2, 0, "auto_unroll_max_step$64"]]]], "r": [[2.88458e-06], 0, 0.71877, 1634814521], "v": "v0.6"}
{"i": [["[\"Layer(\\nops=\\nOp0([1, 16, 10, 10])\\nread_graph=()\\nOp1(\\nSpatial\\naxis=(v0:[1], v1:[16], v2:[10], v3:[10])\\nreduce_axis=()\\ncombiner=()\\nsource=(\\ntir.if_then_else(((((v2 >= 0) && (v2 < 10)) && (v3 >= 0)) && (v3 < 10)), T0[v0, v1, v2, v3], 0f))\\n)\\nread_graph=(Op0)\\nOp2(\\nReduce\\naxis=(v0:[1], v1:[16], v2:[5], v3:[5])\\nreduce_axis=(v4:[2], v5:[2])\\ncombiner=(comm_reducer(result=[(v6 + v7)], lhs=[v6], rhs=[v7], identity_element=[0f]))\\nsource=(\\n(T0[v0, v1, ((v2*2) + v4), ((v3*2) + v5)]/4f))\\n)\\nread_graph=(Op1)\\n)\\n\"]", "cuda -keys=cuda,gpu -max_num_threads=1024 -thread_warp_size=32", [-1, 16, 64, 49152, 2147483647, 1024, 8, 32], "", 0, []], [[], [["CI", 1], ["FU", 2, [0, 1, 2, 3]], ["SP", 2, 0, 400, [4], 1], ["AN", 2, 0, 5], ["AN", 2, 1, 6], ["PR", 2, 0, "auto_unroll_max_step$1024"]]]], "r": [[2.84341e-06], 0, 1.31938, 1634814521], "v": "v0.6"}
{"i": [["[\"Layer(\\nops=\\nOp0([1, 16, 5, 5])\\nread_graph=()\\nOp1(\\nSpatial\\naxis=(v0:[1], v1:[16], v2:[5], v3:[5])\\nreduce_axis=()\\ncombiner=()\\nsource=(\\nT0[v0, v1, v2, v3])\\n)\\nread_graph=(Op0)\\nOp2([120, 16, 5, 5])\\nread_graph=()\\nOp3(\\nReduce\\naxis=(v0:[1], v1:[120], v2:[1], v3:[1])\\nreduce_axis=(v4:[16], v5:[5], v6:[5])\\ncombiner=(comm_reducer(result=[(v7 + v8)], lhs=[v7], rhs=[v8], identity_element=[0f]))\\nsource=(\\n(T0[v0, v4, (v2 + v5), (v3 + v6)]*T1[v1, v4, v5, v6]))\\n)\\nread_graph=(Op1, Op2)\\n)\\n\"]", "cuda -keys=cuda,gpu -max_num_threads=1024 -thread_warp_size=32", [-1, 16, 64, 49152, 2147483647, 1024, 8, 32], "", 0, []], [[], [["CHW", 3, "local"], ["SP", 3, 0, 1, [1, 1, 1, 1], 1], ["SP", 3, 5, 120, [3, 40, 1, 1], 1], ["SP", 3, 10, 1, [1, 1, 1, 1], 1], ["SP", 3, 15, 1, [1, 1, 1, 1], 1], ["SP", 3, 20, 16, [1, 4], 1], ["SP", 3, 23, 5, [1, 1], 1], ["SP", 3, 26, 5, [5, 1], 1], ["RE", 3, [0, 5, 10, 15, 1, 6, 11, 16, 2, 7, 12, 17, 20, 23, 26, 21, 24, 27, 3, 8, 13, 18, 22, 25, 28, 4, 9, 14, 19]], ["FSP", 4, 0, 1, 3], ["FSP", 4, 4, 2, 3], ["FSP", 4, 8, 3, 3], ["FSP", 4, 12, 4, 3], ["RE", 4, [0, 4, 8, 12, 1, 5, 9, 13, 2, 6, 10, 14, 3, 7, 11, 15]], ["CA", 3, 4, 11], ["CHR", 2, "shared", [3]], ["CA", 3, 4, 14], ["CHR", 1, "shared", [4]], ["CA", 2, 5, 14], ["CI", 1], ["FU", 6, [0, 1, 2, 3]], ["AN", 6, 0, 5], ["FU", 6, [1, 2, 3, 4]], ["AN", 6, 1, 4], ["FU", 6, [2, 3, 4, 5]], ["AN", 6, 2, 6], ["FU", 4, [0, 1, 2, 3]], ["SP", 4, 0, 100, [1], 1], ["AN", 4, 1, 2], ["FFSP", 4, 0, [4, 3, 2, 1], 1, 1], ["AN", 4, 1, 6], ["FU", 2, [0, 1, 2, 3]], ["SP", 2, 0, 100, [1], 1], ["AN", 2, 1, 2], ["FFSP", 2, 0, [4, 3, 2, 1], 1, 1], ["AN", 2, 1, 6], ["PR", 5, 0, "auto_unroll_max_step$1024"]]]], "r": [[2.17289e-05], 0, 2.75142, 1634814532], "v": "v0.6"}
{"i": [["[\"Layer(\\nops=\\nOp0([1, 16, 5, 5])\\nread_graph=()\\nOp1(\\nSpatial\\naxis=(v0:[1], v1:[16], v2:[5], v3:[5])\\nreduce_axis=()\\ncombiner=()\\nsource=(\\nT0[v0, v1, v2, v3])\\n)\\nread_graph=(Op0)\\nOp2([120, 16, 5, 5])\\nread_graph=()\\nOp3(\\nReduce\\naxis=(v0:[1], v1:[120], v2:[1], v3:[1])\\nreduce_axis=(v4:[16], v5:[5], v6:[5])\\ncombiner=(comm_reducer(result=[(v7 + v8)], lhs=[v7], rhs=[v8], identity_element=[0f]))\\nsource=(\\n(T0[v0, v4, (v2 + v5), (v3 + v6)]*T1[v1, v4, v5, v6]))\\n)\\nread_graph=(Op1, Op2)\\n)\\n\"]", "cuda -keys=cuda,gpu -max_num_threads=1024 -thread_warp_size=32", [-1, 16, 64, 49152, 2147483647, 1024, 8, 32], "", 0, []], [[], [["CHW", 3, "local"], ["SP", 3, 0, 1, [1, 1, 1, 1], 1], ["SP", 3, 5, 120, [1, 10, 4, 1], 1], ["SP", 3, 10, 1, [1, 1, 1, 1], 1], ["SP", 3, 15, 1, [1, 1, 1, 1], 1], ["SP", 3, 20, 16, [4, 4], 1], ["SP", 3, 23, 5, [1, 1], 1], ["SP", 3, 26, 5, [1, 1], 1], ["RE", 3, [0, 5, 10, 15, 1, 6, 11, 16, 2, 7, 12, 17, 20, 23, 26, 21, 24, 27, 3, 8, 13, 18, 22, 25, 28, 4, 9, 14, 19]], ["FSP", 4, 0, 1, 3], ["FSP", 4, 4, 2, 3], ["FSP", 4, 8, 3, 3], ["FSP", 4, 12, 4, 3], ["RE", 4, [0, 4, 8, 12, 1, 5, 9, 13, 2, 6, 10, 14, 3, 7, 11, 15]], ["CA", 3, 4, 11], ["CHR", 2, "shared", [3]], ["CA", 3, 4, 14], ["CHR", 1, "shared", [4]], ["CA", 2, 5, 14], ["CI", 1], ["FU", 6, [0, 1, 2, 3]], ["AN", 6, 0, 5], ["FU", 6, [1, 2, 3, 4]], ["AN", 6, 1, 4], ["FU", 6, [2, 3, 4, 5]], ["AN", 6, 2, 6], ["FU", 4, [0, 1, 2, 3]], ["SP", 4, 0, 4, [1], 1], ["AN", 4, 1, 2], ["FFSP", 4, 0, [4, 3, 2, 1], 1, 1], ["AN", 4, 1, 6], ["FU", 2, [0, 1, 2, 3]], ["SP", 2, 0, 4, [1], 1], ["AN", 2, 1, 2], ["FFSP", 2, 0, [4, 3, 2, 1], 1, 1], ["AN", 2, 1, 6], ["PR", 5, 0, "auto_unroll_max_step$0"]]]], "r": [[2.9347e-05], 0, 1.39371, 1634814533], "v": "v0.6"}
{"i": [["[\"Layer(\\nops=\\nOp0([1, 16, 5, 5])\\nread_graph=()\\nOp1(\\nSpatial\\naxis=(v0:[1], v1:[16], v2:[5], v3:[5])\\nreduce_axis=()\\ncombiner=()\\nsource=(\\nT0[v0, v1, v2, v3])\\n)\\nread_graph=(Op0)\\nOp2([120, 16, 5, 5])\\nread_graph=()\\nOp3(\\nReduce\\naxis=(v0:[1], v1:[120], v2:[1], v3:[1])\\nreduce_axis=(v4:[16], v5:[5], v6:[5])\\ncombiner=(comm_reducer(result=[(v7 + v8)], lhs=[v7], rhs=[v8], identity_element=[0f]))\\nsource=(\\n(T0[v0, v4, (v2 + v5), (v3 + v6)]*T1[v1, v4, v5, v6]))\\n)\\nread_graph=(Op1, Op2)\\n)\\n\"]", "cuda -keys=cuda,gpu -max_num_threads=1024 -thread_warp_size=32", [-1, 16, 64, 49152, 2147483647, 1024, 8, 32], "", 0, []], [[], [["CHW", 3, "local"], ["SP", 3, 0, 1, [1, 1, 1, 1], 1], ["SP", 3, 5, 120, [1, 120, 1, 1], 1], ["SP", 3, 10, 1, [1, 1, 1, 1], 1], ["SP", 3, 15, 1, [1, 1, 1, 1], 1], ["SP", 3, 20, 16, [4, 1], 1], ["SP", 3, 23, 5, [1, 5], 1], ["SP", 3, 26, 5, [1, 1], 1], ["RE", 3, [0, 5, 10, 15, 1, 6, 11, 16, 2, 7, 12, 17, 20, 23, 26, 21, 24, 27, 3, 8, 13, 18, 22, 25, 28, 4, 9, 14, 19]], ["FSP", 4, 0, 1, 3], ["FSP", 4, 4, 2, 3], ["FSP", 4, 8, 3, 3], ["FSP", 4, 12, 4, 3], ["RE", 4, [0, 4, 8, 12, 1, 5, 9, 13, 2, 6, 10, 14, 3, 7, 11, 15]], ["CA", 3, 4, 11], ["CHR", 2, "shared", [3]], ["CA", 3, 4, 14], ["CHR", 1, "shared", [4]], ["CA", 2, 5, 14], ["CI", 1], ["FU", 6, [0, 1, 2, 3]], ["AN", 6, 0, 5], ["FU", 6, [1, 2, 3, 4]], ["AN", 6, 1, 4], ["FU", 6, [2, 3, 4, 5]], ["AN", 6, 2, 6], ["FU", 4, [0, 1, 2, 3]], ["SP", 4, 0, 20, [2], 1], ["AN", 4, 1, 2], ["FFSP", 4, 0, [4, 3, 2, 1], 1, 1], ["AN", 4, 1, 6], ["FU", 2, [0, 1, 2, 3]], ["SP", 2, 0, 20, [1], 1], ["AN", 2, 1, 2], ["FFSP", 2, 0, [4, 3, 2, 1], 1, 1], ["AN", 2, 1, 6], ["PR", 5, 0, "auto_unroll_max_step$64"]]]], "r": [[2.62336e-05], 0, 1.56285, 1634814533], "v": "v0.6"}
{"i": [["[\"Layer(\\nops=\\nOp0([1, 16, 5, 5])\\nread_graph=()\\nOp1(\\nSpatial\\naxis=(v0:[1], v1:[16], v2:[5], v3:[5])\\nreduce_axis=()\\ncombiner=()\\nsource=(\\nT0[v0, v1, v2, v3])\\n)\\nread_graph=(Op0)\\nOp2([120, 16, 5, 5])\\nread_graph=()\\nOp3(\\nReduce\\naxis=(v0:[1], v1:[120], v2:[1], v3:[1])\\nreduce_axis=(v4:[16], v5:[5], v6:[5])\\ncombiner=(comm_reducer(result=[(v7 + v8)], lhs=[v7], rhs=[v8], identity_element=[0f]))\\nsource=(\\n(T0[v0, v4, (v2 + v5), (v3 + v6)]*T1[v1, v4, v5, v6]))\\n)\\nread_graph=(Op1, Op2)\\n)\\n\"]", "cuda -keys=cuda,gpu -max_num_threads=1024 -thread_warp_size=32", [-1, 16, 64, 49152, 2147483647, 1024, 8, 32], "", 0, []], [[], [["FU", 3, [4, 5, 6]], ["SP", 3, 4, 400, [4], 1], ["AN", 3, 5, 6], ["CI", 1], ["FU", 3, [0, 1, 2, 3]], ["AN", 3, 0, 5], ["PR", 3, 0, "auto_unroll_max_step$64"]]]], "r": [[4.07322e-06], 0, 1.16517, 1634814534], "v": "v0.6"}
{"i": [["[\"Layer(\\nops=\\nOp0([1, 16, 5, 5])\\nread_graph=()\\nOp1(\\nSpatial\\naxis=(v0:[1], v1:[16], v2:[5], v3:[5])\\nreduce_axis=()\\ncombiner=()\\nsource=(\\nT0[v0, v1, v2, v3])\\n)\\nread_graph=(Op0)\\nOp2([120, 16, 5, 5])\\nread_graph=()\\nOp3(\\nReduce\\naxis=(v0:[1], v1:[120], v2:[1], v3:[1])\\nreduce_axis=(v4:[16], v5:[5], v6:[5])\\ncombiner=(comm_reducer(result=[(v7 + v8)], lhs=[v7], rhs=[v8], identity_element=[0f]))\\nsource=(\\n(T0[v0, v4, (v2 + v5), (v3 + v6)]*T1[v1, v4, v5, v6]))\\n)\\nread_graph=(Op1, Op2)\\n)\\n\"]", "cuda -keys=cuda,gpu -max_num_threads=1024 -thread_warp_size=32", [-1, 16, 64, 49152, 2147483647, 1024, 8, 32], "", 0, []], [[], [["CHW", 3, "local"], ["SP", 3, 0, 1, [1, 1, 1, 1], 1], ["SP", 3, 5, 120, [1, 4, 1, 1], 1], ["SP", 3, 10, 1, [1, 1, 1, 1], 1], ["SP", 3, 15, 1, [1, 1, 1, 1], 1], ["SP", 3, 20, 16, [4, 1], 1], ["SP", 3, 23, 5, [1, 5], 1], ["SP", 3, 26, 5, [1, 1], 1], ["RE", 3, [0, 5, 10, 15, 1, 6, 11, 16, 2, 7, 12, 17, 20, 23, 26, 21, 24, 27, 3, 8, 13, 18, 22, 25, 28, 4, 9, 14, 19]], ["FSP", 4, 0, 1, 3], ["FSP", 4, 4, 2, 3], ["FSP", 4, 8, 3, 3], ["FSP", 4, 12, 4, 3], ["RE", 4, [0, 4, 8, 12, 1, 5, 9, 13, 2, 6, 10, 14, 3, 7, 11, 15]], ["CA", 3, 4, 11], ["CHR", 2, "shared", [3]], ["CA", 3, 4, 14], ["CHR", 1, "shared", [4]], ["CA", 2, 5, 14], ["CI", 1], ["FU", 6, [0, 1, 2, 3]], ["AN", 6, 0, 5], ["FU", 6, [1, 2, 3, 4]], ["AN", 6, 1, 4], ["FU", 6, [2, 3, 4, 5]], ["AN", 6, 2, 6], ["FU", 4, [0, 1, 2, 3]], ["SP", 4, 0, 20, [1], 1], ["AN", 4, 1, 2], ["FFSP", 4, 0, [4, 3, 2, 1], 1, 1], ["AN", 4, 1, 6], ["FU", 2, [0, 1, 2, 3]], ["SP", 2, 0, 20, [2], 1], ["AN", 2, 1, 2], ["FFSP", 2, 0, [4, 3, 2, 1], 1, 1], ["AN", 2, 1, 6], ["PR", 5, 0, "auto_unroll_max_step$16"]]]], "r": [[1.03254e-05], 0, 1.48303, 1634814534], "v": "v0.6"}
{"i": [["[\"Layer(\\nops=\\nOp0([1, 16, 5, 5])\\nread_graph=()\\nOp1(\\nSpatial\\naxis=(v0:[1], v1:[16], v2:[5], v3:[5])\\nreduce_axis=()\\ncombiner=()\\nsource=(\\nT0[v0, v1, v2, v3])\\n)\\nread_graph=(Op0)\\nOp2([120, 16, 5, 5])\\nread_graph=()\\nOp3(\\nReduce\\naxis=(v0:[1], v1:[120], v2:[1], v3:[1])\\nreduce_axis=(v4:[16], v5:[5], v6:[5])\\ncombiner=(comm_reducer(result=[(v7 + v8)], lhs=[v7], rhs=[v8], identity_element=[0f]))\\nsource=(\\n(T0[v0, v4, (v2 + v5), (v3 + v6)]*T1[v1, v4, v5, v6]))\\n)\\nread_graph=(Op1, Op2)\\n)\\n\"]", "cuda -keys=cuda,gpu -max_num_threads=1024 -thread_warp_size=32", [-1, 16, 64, 49152, 2147483647, 1024, 8, 32], "", 0, []], [[], [["CHW", 3, "local"], ["SP", 3, 0, 1, [1, 1, 1, 1], 1], ["SP", 3, 5, 120, [1, 120, 1, 1], 1], ["SP", 3, 10, 1, [1, 1, 1, 1], 1], ["SP", 3, 15, 1, [1, 1, 1, 1], 1], ["SP", 3, 20, 16, [2, 2], 1], ["SP", 3, 23, 5, [5, 1], 1], ["SP", 3, 26, 5, [1, 5], 1], ["RE", 3, [0, 5, 10, 15, 1, 6, 11, 16, 2, 7, 12, 17, 20, 23, 26, 21, 24, 27, 3, 8, 13, 18, 22, 25, 28, 4, 9, 14, 19]], ["FSP", 4, 0, 1, 3], ["FSP", 4, 4, 2, 3], ["FSP", 4, 8, 3, 3], ["FSP", 4, 12, 4, 3], ["RE", 4, [0, 4, 8, 12, 1, 5, 9, 13, 2, 6, 10, 14, 3, 7, 11, 15]], ["CA", 3, 4, 11], ["CHR", 2, "shared", [3]], ["CA", 3, 4, 14], ["CHR", 1, "shared", [4]], ["CA", 2, 5, 14], ["CI", 1], ["FU", 6, [0, 1, 2, 3]], ["AN", 6, 0, 5], ["FU", 6, [1, 2, 3, 4]], ["AN", 6, 1, 4], ["FU", 6, [2, 3, 4, 5]], ["AN", 6, 2, 6], ["FU", 4, [0, 1, 2, 3]], ["SP", 4, 0, 100, [1], 1], ["AN", 4, 1, 2], ["FFSP", 4, 0, [4, 3, 2, 1], 1, 1], ["AN", 4, 1, 6], ["FU", 2, [0, 1, 2, 3]], ["SP", 2, 0, 100, [1], 1], ["AN", 2, 1, 2], ["FFSP", 2, 0, [4, 3, 2, 1], 1, 1], ["AN", 2, 1, 6], ["PR", 5, 0, "auto_unroll_max_step$16"]]]], "r": [[1.7026e-05], 0, 1.52737, 1634814535], "v": "v0.6"}
{"i": [["[\"Layer(\\nops=\\nOp0([1, 16, 5, 5])\\nread_graph=()\\nOp1(\\nSpatial\\naxis=(v0:[1], v1:[16], v2:[5], v3:[5])\\nreduce_axis=()\\ncombiner=()\\nsource=(\\nT0[v0, v1, v2, v3])\\n)\\nread_graph=(Op0)\\nOp2([120, 16, 5, 5])\\nread_graph=()\\nOp3(\\nReduce\\naxis=(v0:[1], v1:[120], v2:[1], v3:[1])\\nreduce_axis=(v4:[16], v5:[5], v6:[5])\\ncombiner=(comm_reducer(result=[(v7 + v8)], lhs=[v7], rhs=[v8], identity_element=[0f]))\\nsource=(\\n(T0[v0, v4, (v2 + v5), (v3 + v6)]*T1[v1, v4, v5, v6]))\\n)\\nread_graph=(Op1, Op2)\\n)\\n\"]", "cuda -keys=cuda,gpu -max_num_threads=1024 -thread_warp_size=32", [-1, 16, 64, 49152, 2147483647, 1024, 8, 32], "", 0, []], [[], [["CHW", 3, "local"], ["SP", 3, 0, 1, [1, 1, 1, 1], 1], ["SP", 3, 5, 120, [1, 120, 1, 1], 1], ["SP", 3, 10, 1, [1, 1, 1, 1], 1], ["SP", 3, 15, 1, [1, 1, 1, 1], 1], ["SP", 3, 20, 16, [4, 1], 1], ["SP", 3, 23, 5, [1, 5], 1], ["SP", 3, 26, 5, [1, 1], 1], ["RE", 3, [0, 5, 10, 15, 1, 6, 11, 16, 2, 7, 12, 17, 20, 23, 26, 21, 24, 27, 3, 8, 13, 18, 22, 25, 28, 4, 9, 14, 19]], ["FSP", 4, 0, 1, 3], ["FSP", 4, 4, 2, 3], ["FSP", 4, 8, 3, 3], ["FSP", 4, 12, 4, 3], ["RE", 4, [0, 4, 8, 12, 1, 5, 9, 13, 2, 6, 10, 14, 3, 7, 11, 15]], ["CA", 3, 4, 11], ["CHR", 2, "shared", [3]], ["CA", 3, 4, 14], ["CHR", 1, "shared", [4]], ["CA", 2, 5, 14], ["CI", 1], ["FU", 6, [0, 1, 2, 3]], ["AN", 6, 0, 5], ["FU", 6, [1, 2, 3, 4]], ["AN", 6, 1, 4], ["FU", 6, [2, 3, 4, 5]], ["AN", 6, 2, 6], ["FU", 4, [0, 1, 2, 3]], ["SP", 4, 0, 20, [1], 1], ["AN", 4, 1, 2], ["FFSP", 4, 0, [4, 3, 2, 1], 1, 1], ["AN", 4, 1, 6], ["FU", 2, [0, 1, 2, 3]], ["SP", 2, 0, 20, [2], 1], ["AN", 2, 1, 2], ["FFSP", 2, 0, [4, 3, 2, 1], 1, 1], ["AN", 2, 1, 6], ["PR", 5, 0, "auto_unroll_max_step$64"]]]], "r": [[2.55554e-05], 0, 1.50268, 1634814535], "v": "v0.6"}
